,NAME
WHEAT PREM DARA LOOSE,20
RICE JEERA PREMIUM LOOSE,20
GH RR DAL MAKHANI KIT 250g,20
MOONG DAL SPLIT PREM LOOSE,20
KARMIQ RAISIN INDIAN PP 100g,20
GH CHANA KABULI STD 1K,20
WHO CHAWLI WHITE LOOSE,20
GH PULSES WHO URAD WHITE PRM 1kg,20
GH KURMURA MURMURA BHADANG PP 200g,20
GH WHO SPICE CASSIA SPLIT 25g,20
DESI ATTA JOWAR/SORGHUM ATTA PP 500g,20
WATANA WHITE LOOSE,20
GH POWDER SPICE TURMERIC PP 1kg,20
BARLEY LOOSE,20
GHPR LITTLE MILLET PP 500g,20
EKTAA SOYA MINI CHUNKS BX 200g,20
SOYABEAN LOOSE,20
KANAKI LOOSE,20
BLACK CHIA SEEDS LOOSE,20
GH RAJMA SHARMILI RED SMALL 1k,20
RICE DUDHESWAR SUPREME LOOSE,19
DESI ATTA CHIROTI RAVA PP 1Kg,19
RICE JEERA KATI LOOSE,19
GOLDEN HARVEST CASHEW 2P 200g,19
SANGIS KTCN WHITE ROCK SLT GRNDR BT 100g,19
GHPR CHANA MAUSAMI PP 1Kg,19
GH RICE BOILED IR UKDA 1Kg,19
WHEAT SIHORE A LOOSE,19
NAWAB PASAND LOOSE,19
RICE CHINESE BIRYANI LOOSE,19
EKTAA KURMURA PP 500g,19
BASMATI RICE MOHANBHOG LOOSE,19
GH RR MISAL KIT 180g,19
SANGIS KICTHEN CUMIN WHOLE PP 200g,19
GHPR GREN PEAS PP 500g,19
ARWA KATARNI STANDARD LOOSE,19
FRESH & PURE SOYABEAN OIL JR 5L,19
GH BHAJKA POHA 500g,19
GH FRUIT N NUT PISTA PLAIN PP 100g,19
WHEAT DAUDKHANI LOOSE,19
FRESH & PURE DESI GHEE BX 500ml,19
SANGIS KITCHEN CUMIN WHOLE PP 100g,19
RICE HMT PREMIUM NEW LOOSE,19
MASOOR DAL PREMIUM 2Kg,19
MIXED DRY FRUIT LOOSE,19
GH POWDER SPICE RED CHILLI PP 1kg,19
GHPR LAPSI DALIYA SML 500g,19
GH AKHROT GIRI POPULAR 200g,19
GOLDEN HARVEST KISMIS AFGAN 100g,19
GHPR KABULI CHANA PP 500g,19
MOONG DAL CHILKA 2Kg,19
GRAM WHITE DOLLAR LOOSE,19
GH RR MEXICAN RICE KIT 240g,19
BESAN 500g,19
GHPR SABUDANA 500g,19
RAJMA CHITRA 2 Kg,19
DESI ATTA FINE BESAN PP 1Kg,19
SK BLK PPR + RED CHL FLKS+ELC DN 140g OP,19
GHPR SOYABEAN WHOLE PP 500g,19
GH BASMATI RICE MOGRA PP 5kg,19
RICE BASMAT SELLA SUPREME LOOSE,19
GHPR URAD WHOLE WHITE PP 500g,18
GH DGDI CHWDA POHA 500g,18
RICE BORA STANDARD LOOSE,18
KARMIQ DL ENGY BTS RST&SLT PISTA PP 450g,18
RICE ANDHRA BOILED LOOSE,18
GHPR CHANA RED PP 500g,18
GH WHO SPICE SABJA 100g,18
PH WHO SPICE YELLOW SARSON 200G,18
GH CARDAMOM POWDER BT 50g,18
ECONOMY MASOORI LOOSE,18
GH RR PACNHRATNA DAL KIT 185g,18
GH WHO SPICE BADIYAN 100g,18
RICE BOILED LOOSE,18
GH SABUDANA NYLON 500G,18
GH NACHANI 500g,18
GHPR RAJMA KASHMRI PP 500g,18
GH DAILY OTH PULSE CHANA GREEN 500g,18
MASOOR DAL 500g,18
GOLDEN HARVEST ANJEER 200g,18
GHPR CHAT CHANA PP 500g,18
KHARBOOJ SEEDS LOOSE,18
RICE IR UKDA LOOSE,18
GH FRUIT N NUT KAJU MSL BLK PEPPER 100g,18
MAIDA 1Kg,18
RICE FOOTBALL LOOSE,18
GH TUR DAL PREMIUM 5Kg,18
GH SURTI KOLAM PREMIUM RICE 10Kg,18
GH WHO SPICE GREEN CARDMM 100g,18
SANGIS KTCN LEMONGRASS SPRINKLER BT 7g,18
SANGIS KITCHEN SEA SALT GRINDER BT 100g,18
QUINOA RED LOOSE,18
DUDHESWAR STANDARDBOILED RICE LOOSE,18
CHIA SEEDS WHITE LOOSE,18
GH POW SPICE DRY MANGO PP 200g,18
GH BASMATI RICE MINI MOGRA BG 5Kg,18
JASMINE RICE LOOSE,18
GH URAD DAL GUNDU PREM 1K,18
GHPR URAD DAL PP 1Kg,18
GH DAILY OTH PULSE CHANA DAL PREM 2K,18
PARMAL SELLA LOOSE,18
GOLDEN HARVEST CASHEW 4P 100g,18
DESI ATTA UPMA SUJI PP 500g,18
GHPR CHANA DAL PP 1Kg,18
KARMIQ MUNCHIES CSHW CHT MASALA PP 18g,17
GH WHO SPICE TEJ PATTA 100g,17
GH FUTANA FRIED 500g,17
WHT PEPPER LOOSE,17
EKTAA FTN BHUNA BHUNJA CHANA PP 500g,17
SURTI RICE KOLAM BAG 25Kg,17
GH CORN 200g,17
GH FRUIT N NUT APRICOT WHOLE PP 200g,17
GH WHO SPICE MARATHI MOGGU 50g,17
WHEAT ATTA SAMPOORNA PP 10Kg,17
GH WAL SURTI 500g,17
WHEAT 2189 LOOSE,17
GH BASMATI SELLA RICE PP 1kg,17
URAD GUNDU PREMIUM 2Kg,17
WHEAT SARBATI PEARL LOOSE,17
GH PRIME SORGHUM MILLET PP 500g,17
GH OTH PULSE WATANA WHITE 1K,17
GH READYMIX CHANA 100g,17
GH KURMURA BASMATI 500g,17
GOLDEN HARVEST MUNAKA 200g,17
GH IDLI RICE 2K,17
JUWAR STANDARD LOOSE,17
GOLDEN HARVEST KHARIK BLACK 500g,17
GH WH CHANA KABULI WHO 1kg,17
GH WHO SPICE WHITE TIL 500g,17
GH WHO SPICE KOKAM PANDI 100g,17
SANGIS KITCHEN YELLOW MUSTARD PP 100g,17
GH PRIME WHO SPICE BLK PEPR 100g,17
SANGIS KTCN KASHMIRICHILLI PWDR PP 100g,17
GHPR MOONG DAL PP 1Kg,17
SUJI 1Kg,17
SANGIS KTCN PINK ROCK SALT GRNDR BT 100g,17
GHPR CHANA DAL PP 500g,17
PH MASUR DAL PP 500g,17
GH WHO SPICE BLACK TIL 200g,17
GH FRUIT N NUT KAJU MASALA CHILLI 100g,17
GH RAJMA CHAKROTA DISCO PP 1kg,17
FRESH & PURE KCHI GHNI MUSTRD OIL TN 15K,17
SUJI 500g,16
KARMIQ ROYAL PISTA JAR 600g,16
AGRIPURE ATTA SAMPOORNA 10kg,16
GH POHA 1Kg,16
CHANA KESARI LOOSE,16
GH OTH FLOUR RICE 500g,16
GHPR RAJMA CHTRA PP 500g,16
WHEATMP SARBATI PEARL 30Kg,16
1014BOILED RICE LOOSE,16
WHEAT LOKWAN RUBY LOOSE,16
GH WATANA GREEN 1Kg,16
BOILD RICE CHEAP AND BEST LOOSE,16
RICE BOILED USNA PRML STD LOOSE,16
GH SONA MASOORI RICE CLASSIC BG 25Kg,16
WAL KADWA LOOSE,16
GH MASOOR DESI MALKA 500g,16
GHPR MILET FOXTAIL PP 500g,16
GHPR TOOR DAL PP 1Kg,16
KARMIQ MNCS CSHEW SOUR CRM&ONION PP 18g,16
GH WHO SPICE MARATHI MOGGU 25g,16
GOLDEN HARVEST CASHEW 2P 100g,16
GH WHO SPICE RED CHILLI 200g,16
BASMATI RICE DUBAR LOOSE,16
WATANA GREEN LOOSE,16
SANGIS KITCHEN ROCK SALT PINK PP 200g,16
RICE MOGRA PREMIUM LOOSE,16
EVERYDAY RICE LOOSE,16
CHAKKI WHITE JOWARI LOOSE,16
GH WHOSPICESAUNFROASTED 200g,16
GH WHO SPICE KASHMRI CHILI 200g,16
PREMIUM FIGS LOOSE,16
INDRAYANI SPECIAL LOOSE,16
SABUDANA BIG LOOSE,16
KARMIQ ALMOND VAL PP 200g,16
GH SUGAR KHADI 100g,16
GH RR PUNJABI DAL KIT 185g,16
GH CHANA KESARI 500g,16
GH WHO SPICE DRY GINGER 100g,16
NATURES CHOICE AMLA CANDY SWEET 200g,16
GH SEASONING CHILLI FLAKES BT 45g,16
GHPR SORGHUM MILLET PP 500g,16
GHPR KABULI CHANA PP 1Kg,16
SARVOTAM POPULAR LOOSE,16
BUSTAAN DATES SULTAN BX 500g,16
MAIDA 500g,16
GH DAILY MATKI DAL PP 500g,16
GH CHANA DALIYA 200g,16
GH JEERASAR PP 1kg,16
GH RICE BASMATI TIBAR 10kg,16
KRISHNA KAMOD LOOSE,16
RICE BASMATI DUBAR STD LOOSE,15
RICE PONIA LOOSE,15
GH FRUIT N NUT KAJU MSL BLK PEPPER 200g,15
KARMIQ SAFFRON PRSIAN PP 1g,15
BUSTAAN DATES KHANEESI BX 500g,15
GH DRY FRUIT ALMOND 450Gg GP,15
GH SABUDANA POHA 200g,15
MATKI DAL LOOSE,15
GOLDEN HARVEST KISMIS PREMIUM 100g,15
GH WHO SPICE AJWAIN 50g,15
RAW RICE KOLPI GHOTI LOOSE,15
EKTAA AVALLAKHI POHA PP 1Kg,15
MOTHER EARTH MUSTARD BIG ORGANIC PP 100g,15
RICE WADA KOLAM NEW LOOSE,15
GH RAJMA KASHMIRI RED BIG 1kg,15
SAT ANAJ LOOSE,15
KARMIQ THITRY DAY PACK ASRTD R&S PP 450g,15
RICE SONA MASORI STANDARD LOOSE,15
SANGIS KITCHEN TURMERIC WHOLE PP 100g,15
EKTAA JAGGERY PREMIUM JR 250g + 50g,15
GH SABUDANA INSTANT 500g,15
PH CHANA RED PP 1Kg,15
GH PULSES YELLOW MASOOR DAL PP 500g,15
FRESH & PURE GROUNDNUT OIL PP 1L,15
GH WHO SPICE NYLON TIL 100g,15
RAW RICE SADHU AIJAN LOOSE,15
GH SUPERFINE SUGAR PP 500g,15
EKTAA MLTS BHAGHAR MORDHAN PP 500g,15
GOLDEN HARVEST KHARIK BLACK PP 200g,15
GOLDEN HARVEST PEANUT 100g,15
DESI ATTA CO MATHARI MIX PP 500g,15
GH WHO SPICE MUSTARD DAL 100g,15
BASMATI RICE KRT BROKEN LOOSE,15
GH WHO SPICE SAUNF ROASTD 100g,15
GH DAILY TUR DAL STD 500g,15
RICE ANDHRA KOLAM LOOSE,15
EKTAA TAL MAKHANA BX 50g,15
BUSTAAN DATES LULU BX 500g,15
GH BLACK PEPPER WHOLE PP 200g,14
MOONG DAL SUPREME LOOSE,14
MINIKET SUPREMEBOILED RICE LOOSE,14
GHPR RAJMA SHARMLI PP 500g,14
SANGIS KITCHEN CHILLI POWDER PP 200g,14
GHPR PEARL MILLET PP 500g,14
GOLDEN HARVEST PREMIUM CASHEW 400g,14
GH WHO SPICE JEERA 1Kg,14
DESI ATTA CO BEDAMI POORI MIX PP 500g,14
RICE DUBRAJ NEW LOOSE,14
GH SUGAR MISHRI DANA 500g,14
GH SUGAR 10kg,14
RICE BASMAT SELLA PREMIUM LOOSE,14
PH MOTH WHOLE PP 500g,14
GHPR MOONG WHOLE GREEN PP 500g,14
WHEAT BANSI A LOOSE,14
URAD DAL 500g,14
PH RAJMA CHITRA PP 1Kg,14
MOTHER EARTH WHOLE WHEAT CHK ATTA PP 5Kg,14
GH WHO SPICE NYLON TIL 200g,14
RICE SURTI KOLAM PREM NEW LOOSE,14
GH OTH FLOUR RAGI 1Kg,14
RAW RICE SUNFLOWER RAMPAL LOOSE,14
GH FRUIT N NUT ANJEER STANDARD 100g,14
BLACK TIL LOOSE,14
BIG MUSTRD LOOSE,14
PH MOONG DAL PP 1Kg,14
KARMIQ ALMONDS VAL PP 1Kg,14
RAW RICE HMT KOLAM LOOSE,14
JAGGERY LOOSE,14
GH FRUIT&NUT MIX DRY FRUIT PP 500g,14
RICE AMBAMOHAR PREMUM NEW LOOSE,14
GH FRUIT N NUT ANJEER STANDARD 500g,14
MIX DAL 2KG,14
NAFIS BASMATI RICE LOOSE,14
GHPR KODO MILLET PP 500g,14
GH SABUDANA SMALL 200G,14
GH FRUIT N NUT KAJU SALTED 100g,14
SANGIS KITCHEN NUTMEG/JAIPHAL PP 25g,14
GH DAILY CHAWLI DAL PP 500g,14
GH CHANA KESARI 1kg,14
GOLDEN HARVEST GOND 200g,14
GH KURMURA BHADANG 500g,14
SANGIS KITCHEN OREGANO REFILL PACK PP 8g,14
EKTAA JAGGERY AJWAIN JR 250g + 50g,14
SUNFLWER SEED LOOSE,14
JEERASAR STD LOOSE,14
PH WHO SPICE METHI DANA 200g,14
GH GROUNDNUT 200G,14
POHA THIN LOOSE,14
SWARNA BOILED RICE LOOSE,13
RICE SURTI KOLAM STD NEW LOOSE,13
KARMIQ VIVID ELEGANCE DFT GIFT BX 300g,13
GH MURMURA 200g,13
BLK PEPPER LOOSE,13
RAJMA CHAKROTA LOOSE,13
MASOOR DAL 1Kg,13
PH CHANA DAL PP 500g,13
GROUNDNUT STD LOOSE,13
GHPR URAD CHILKA PP 500g,13
SARVOTAM PREMIUM LOOSE,13
GHPR YELOW PEAS PP 500g,13
RICE KOLAM ECONOMY LOOSE,13
FRESH&PURE SOYABEAN OIL REFINED JR 15L,13
WHEAT ATTA 10Kg,13
NATURE CHOICE DRY FRT CASHEW JR 500g,13
GH SONA MASOORI RICE SUPREME BG 25Kg,13
GH FRUIT N NUT KAJU SALTED 200g,13
URAD DAL GUNDU STD LOOSE,13
RICE BASMATI PULAV STD LOOSE,13
GH HYBD BIRYANI RICE 25Kg,13
RICE KOLAM KANI LOOSE,13
RAVA SUJI LOOSE,13
SANGIS KITCHEN DRY GINGER POWDER 35g,13
WHITE TIL LOOSE,13
RICE BIRYANI LOOSE,13
RAW RICE BROKEN RICE LOOSE,13
GH WHO SPC WATERMELON SEEDS PP 50g,13
GH DAILY RAVA/SUJI SMALL 1Kg,13
CLOVE LOOSE,13
PH MOONG DAL CHILKA PP 500g,13
GHPR URAD CHILKA PP 1Kg,13
SELLA REGULAR LOOSE,13
GH DAILY RAVA/SUJI 500g,13
CHAWLI BLACK EYE LOOSE,13
KAJU PREMIUM LOOSE,13
WHEAT SARBATI DIAMOND LOOSE,13
BEMISAL REGULAR LOOSE,13
KASHMIRI KESHAR RICE LOOSE,13
CHANA KABULI DOLLAR LOOSE,13
DESI ATTA BANSI RAVA PP 500g,13
GH RICE SURTI KOLAM 25Kg,13
EKTAA AVALLAKHI POHA PP 500g,13
SALTED PISTACHIOS 333 LOOSE,12
KHURBANI LOOSE,12
GH PISTA SALTED 100g,12
MOONG WHOLE 1KG,12
METHI DRY LOOSE,12
MASOORI SPECIAL RAW RICE LOOSE,12
DALIYA 1Kg,12
KAJU SUPREME LOOSE,12
GH ICING SUGAR PP 500g,12
RICE GOBINDO BHOG SUPREME LOOSE,12
GHPR AMARANTH PP 500g,12
KALONJI LOOSE,12
GH SPICEWHODALCHINIPRM 50g,12
TURMERIC LOOSE,12
GOLDEN HARVEST ALMOND SANORA PP 500g,12
PONNY BOILED PREMIUM LOOSE,12
KARMIQ ROYAL CASHEW JAR 700g,12
PH URAD WHOLE BLACK PP 500g,12
AGRIPURE ATTA SAMPOORNA PP 5kg,12
RICE GIDDA LOOSE,12
RAW RICE RAMPAL JOHA LOOSE,12
SANGIS KITCHEN GREEN CARDAMOM PP 25g,12
GH RAJMA JAMMU 1K,12
RAJMA SHRMILI RED SML LOOSE,12
TUR DAL STD 2Kg,12
SELLA MINI MOGRA LOOSE,12
KARMIQ CASHEW VAL PP 750g,12
GH PRIME MILET FOXTAIL PP 500g,12
GH FUTANA FRIED 200g,12
MINIKET POPULARBOILED RICE LOOSE,12
GH WHITE BUTTER BEANS 200g,12
GH WHO SPICE TAMARIND 1Kg,12
PH WHO SPICE CORIANDR 100g,12
PH CHANA RED PP 500g,12
CHANA GREEN LOOSE,12
GH WHO SPICE SAUNF SMALL 500g,12
GH WHO SPICE RED CHILLI 500g,12
EKTAA CANDY JAGGERY CARDAMOM JR 250g,12
GH WHO SPICE COCONUT 200g,12
GH JUWAR STANDARD 1kg,12
SANGIS KITCHEN SHAHI JEERA PP 50g,12
URAD DAL 1Kg,12
URAD DAL 2 kg,12
RICE HAND FOUND LOOSE,12
GH WATANA BLACK 500g,12
GOLDEN HARVEST GURBANDI GIRI 200g,12
TULSIBHOGRAW RICE LOOSE,12
MASOOR MALKA RED 2Kg,12
SANGIS KICHEN GUNTUR CHILLI WHOLE PP 50g,12
RAW RICE ZAIKA PREMIUM LOOSE,12
WHEAT CHAKKI SIHORE SHRBT LOOSE,12
GH DRY FRUIT KALIDARAK PP 500g,12
SANGIS KITCHEN CHILLI POWDER PP 100g,12
GH WHO SPICE LONVLA KOKAM 100g,12
GH RICE BASMATI EVERYDAY 25kg,12
GH CHAWLI WHITE LOBHIA 200g,11
CPL SONA MASOORI STEAM RICE 25K,11
GH DRY FRT GIFT BOX POTLI 300g,11
GH DAILY RAVA/SUJI SMALL 500g,11
PARMAL PREMIUM LOOSE,11
KAJU STANDARD LOOSE,11
RICE BASMATI SUPREME LOOSE,11
RICE SONA MASOORI CLASSIC LOOSE,11
GH BAJRA STANDARD 500g,11
MAIZE LOOSE,11
URAD DAL CHILKA LOOSE,11
GH WHO SPICE KHUS KHUS 500g,11
MOONG WHOLE 500g,11
FRESH & PURE YELLOW MUSTARD OIL BT 1L,11
NILGIRIS WALNUT OIL BOTTLE 50ml,11
RICE SURTI KOLAM STEAM LOOSE,11
BOILED RC ROSE DOUBL UNDA LOOSE,11
AVALAKKI THICK LOOSE,11
GH FRUIT&NUT KHARIK BLACK PP 200g,11
MOONG CHILKA 1Kg,11
RAW RICE HMT STEAM LOOSE,11
GH RED DOUBLE BEANS 200G,11
BPT REG LOOSE,11
URAD DAL STD LOOSE,11
NATURE CHOICE DRY FRUIT MIX JAR 200g,11
POHA NYLON LOOSE,11
DRY FRUIT KISMISH INDIAN LOOSE,11
BUSTAAN DATES MABROOM BX 500g,11
BLK CARDAMM LOOSE,11
ARWA SONACHUR PREMIUM LOOSE,11
GH SABUDANA INSTANT 1kg,11
RAJMA SRINAGAR LOOSE,11
DESI ATTA UPMA SUJI PP 1kg,11
GH WHO SPICE HALEEM 100g,11
RAJMA CHITRA 500g,11
GH FUTANA FRIED 1K,11
NILGIRI LITTLE MILLET SAAMAI PP 500g,11
GH WHITE DOUBLE BEANS 200g,11
MUGHLAI BIRYANI LOOSE,11
PONNY RAW RICE PREMIUM LOOSE,11
PH KABULI CHANA PP 500g,11
PH SABUDANA 500g,11
CHANA KALA 1Kg,11
GH TUR DAL LATUR PREMIUM 5Kg,11
SANGIS KITCHEN CHILLI POWDER PP 500g,11
BUSTAAN DATES SAFAWI AL MADINA BX 500g,11
SUGAR DIAMOND LOOSE,11
GH WHO SPICE SAUNF SWEET 100g,11
NILGIRIS COW GHEE SPECIAL PP 500ml,11
GH BARLEY 200g,11
GHPR FINGER MILLET PP 500g,11
SANGIS KITCHEN NUTMEG/JAIPHAL PP 50g,11
GH PISTA SALTED 200g,11
BESAN LOOSE,11
GOLDEN SELLA REGULAR LOOSE,11
GH POW SPICE CUMIN CORIANDER 200g,11
KARMIQ DRIED CRNBR & BLBR & APRT 300g GP,11
RICE AMBAMOHAR STANDARD LOOSE,11
SURTI KOLAM RICE BG 10Kg,11
GH URAD DAL WHO URAD WHT PRM 500g,11
BEMISAL TINY MOGRA LOOSE,11
NATURE CHOICE ALMOND PREMIUM JR 200g,11
JEERA LOOSE,11
DRY FRUIT KAJU 4PC LOOSE,11
RICE PARMAL STANDARD LOOSE,11
RICE RAJA RANI LOOSE,10
GH HMT REGULAR 25Kg,10
GH NYLON SABUDANA 200g,10
GH DAILY MAIDA 1Kg,10
KULTHI LOOSE,10
GH WHO SPICE GARAM MASALA PP 500g,10
GH POHA MAKAI 500G,10
AFGHAN RAISINS LOOSE,10
BEMISAL DUBAR LOOSE,10
DESI ATTA BANSI RAVA PP 1Kg,10
RICE DASH LOOSE,10
MASOOR DESI MALKA LOOSE,10
GOLDEN HARVEST ALMONDS STD PP 500g,10
WHITE GOLDEN SELLA LOOSE,10
GH SONA MASOORI RICE POPULAR BG 10Kg,10
RICE MINI KOLAM PREMIUM LOOSE,10
BOILED RICE ROSE DOUBLE LOOSE,10
RAW RICE DUDH MALAI NEW LOOSE,10
GH ROASTED AKKI THARI PP 1kg,10
GH FRUIT&NUT DATES DRY PP 200g,10
GH MOONG DAL WHOLE 2k,10
GH MOCHAI WHITE 200g,10
DRY FRUIT KHARIK BLACK LOOSE,10
RICE LONG BOILED LOOSE,10
GOLDEN HARVEST ALMD+CASHEW+RAISINS 300g,10
GH DRY FRUIT KHARIK YELLOW 500G,10
PUMPKIN SEED GREEN LOOSE,10
RICE WADA KOLAM LOOSE,10
HMT KOLAM RICE BG 10Kg,10
RICE BASMATI SELLA STD LOOSE,10
GH CHAWLI SMALL 500g,10
SAUNF LOOSE,10
GH CHANA KABULI PREMIUM 2k,10
GH RAJMA SHARMILI 200g,10
GH READYMIX CHAT 100g,10
GH SONA MASOORI RICE STANDARD BG 10Kg,10
GH WHO SPC KASHMIRI CHILLI PP 50g,10
GH RAJMA KASHMIRI RED BIG 200g,10
SANGIS KITCHEN SEA SALT PP 200g,10
PH WHO SPICE KHUS KHUS 50g,10
NATURE CHOICE DRY FRUIT MIX JR 500g,10
GH OTH FLOUR CORNFLOUR 500G,10
CASSIA SPLIT LOOSE,10
BOILED RICE LAXMIBHOG LOOSE,10
RICE BASMATI BROKEN LOOSE,10
KARMIQ CRMG EXTRAVAGANCE DFT GFT BX 380g,10
GH BASMATI POHA PP 500g,10
GH FRUIT N NUT KHARIK TUKDI 200g,10
KURUVA YELLOW SNGL BOILED LOOSE,10
SANGIS KITCHEN TANDOORI MASALA BX 50g,10
NILGIRIS COW GHEE SPECIAL PP 200ml,10
NILGIRIS GINGELLY OIL PP 200ml,10
GH DAILY RAVA/SUJI 1Kg,10
DRY FRT WATER MELON SEED LOOSE,10
PAPDI BB WAL LOOSE,10
RICE PAUNIA BASMATI PRM LOOSE,10
PULSES WHO URAD WHITE PRM LOOSE,10
PONGAL FLOUR RICE LOOSE,10
ATTA LOOSE,10
NATURE CHOICE DRY FRT ALMOND JR 200g,9
GH WHO MOONG 200g,9
GH GROUNDNUT INSHELL ROASTED PP 1Kg,9
MOONG DAL SPLIT STD LOOSE,9
CHANA KABULI DOLLAR 500g,9
GH WAL RANGUNI 500g,9
RICE PAUNIA BASMATI STD LOOSE,9
BPT RAW RICE LOOSE,9
GH WHO SPICE AJWAIN 500g,9
BADAM PREMIUM LOOSE,9
NILGIRIS COW GHEE JR 200ml,9
GH OTH FLOUR RICE 1Kg,9
BOILED RICE PARIMAL SELLA LOOSE,9
PH MASUR DAL PP 1Kg,9
GOLDEN HARVEST PEANUT 200g,9
SELLA DUBAR LOOSE,9
NILGIRIS COW GHEE JR 1L,9
RICE CUT SAMBHAR LOOSE,9
URAD DAL GUNDU PRM LOOSE,9
SANGIS KITCHEN MUSTARD DAL PP 50g,9
GH RICE KOLAM SUPREME 10kg,9
RICE BIRYANI PULAV LOOSE,9
GH DAILY MOONG DAL STD 500g,9
GH ALMND 200g+ CASHEW 200g+ KISMIS 200G,9
GH URAD GUNDU PREMIUM 2K,9
GH WHO SPICE DHANIA LOCAL PP 500g,9
RAW RICE NEW KALIMUCH LOOSE,9
GH DAILY TUR+MASOOR+MOONG DAL PREM 3K OP,9
WHEAT LOKWAN SAPPHIRE LOOSE,9
GH WHO SPICE TAMARIND CUBE 1Kg,9
SANGIS KITCHEN MUSTARD SMALL PP 200g,9
MASOOR WHOLE 2Kg,9
GH WHO SPICE KARLA PP 500g,9
MINIKET PREMIUMBOILED RICE LOOSE,9
NILGIRIS CAKE SEED JR 100g,9
WADA KOLAM RICE,9
MOTHER EARTH MASOOR DAL 1Kg,9
GH FRUIT N NUT WALUNT GIRI PP 100g,9
RAW RICE RAJAMUDI LOOSE,9
RAJMA CHITRA 1Kg,9
GH SPICES CHILLI FLAKES PP 100g,9
GH ROASTED RAGI HURI HITTU PP 500g,9
DAILY BASMATI RICE LOOSE,9
RICE LOVELY LOOSE,9
BOILD RC KURUVA WHTE SNGL LOOSE,9
ARWA MASOORI STANDARD LOOSE,9
KARMIQ ALMOND PP 15g,9
RAW RICE ASSAMESE JOHA LOOSE,9
RICE BASMATI NEW PREMIUM LOOSE,9
DAILY PONNI STEAM RICE LOOSE,9
SANGIS KITCHEN AGLIO OLIO MIX BX 50g,9
GH MASOOR DESI MALKA 1kg,9
RICE MINI DUBAR LOOSE,9
GH WHEAT 7 GRAIN SATNAJA 5kg,9
BOILD RICE SUREKHA DOUBLE LOOSE,9
GUNDU CHILLI LOOSE,9
KARMIQ GRN AFGHAN RAISIN PP 100g,9
NILGIRIS COW GHEE JR 500ml,9
RAGI LOOSE,9
GH AVALAKHI THIN 1kg,9
GH RICE MASOORI PP 5kg,9
GH WHO SPICE BORE CHILLI PP 50g,9
GH WHO SPICE BLACK TIL 50g,9
DRY FRUIT KAJU 2PC LOOSE,9
KARMIQ DAILY ENERGY BITES CASHEW PP 450g,9
GH WHO SPICE BROWN TIL PP 200g,9
GOLDEN HARVEST CASHEW CHILKA PP 200g,9
GH RAGI WHOLE 1kg,9
GH SABUDANA BIG 1kg,9
GOLDEN HARVEST CASHEW BLISTER 400g,9
GH SOYA MINI CHUNKS PP 200g,9
GH SOUTH INDIAN PULAV RICE PP 1kg,8
RAVA SUJI IDLI LOOSE,8
GH DAILY RAVA/SUJI BENSI 500g,8
RICE PARMAL TUKDI LOOSE,8
GH SONA MASOORI RICE CLASSIC BG 10Kg,8
NILGIRIS BARNYARD KUTHIRAVALI PP 500g,8
PH WHO SPICE BIG SAUF 200g,8
GH DAILY MAIDA 2Kg,8
GH SONA MASOORI RICE POPULAR BG 25Kg,8
IDLI RICE PP 2Kg,8
GH RICE SAKKAR CHINI KATTA 25kg,8
SUGAR LARGE LOOSE,8
MASOOR WHOLE BLACK 1Kg,8
KARMIQ MUNCHIES DFT GIFT BOX 54g OP,8
MOTHER EARTH TUR DAL PP 1Kg,8
GH JAGGERY CUBE 1Kg,8
BASKATI SUPREME BOILED RICE LOOSE,8
GH MAKKA POHA 500g,8
RAW RICE CHINOOR SUGANDHI LOOSE,8
GH DAILY RAVA/SUJI BENSI 1Kg,8
GHPR MASUR DAL PP 1Kg,8
RAW RICE BENGAL JOHA LOOSE,8
GH MASOOR DESI 1Kg,8
NILGIRIS ALMOND OIL BOTTLE 50ml,8
ANJEER SUPREMS LOOSE,8
GH DRY FRUIT POTLI 600g,8
APRICOT GIRI LOOSE,8
HMT RICE KOLAM BAG 25Kg,8
LAVNG CHILLI LOOSE,8
GH DATES DRY 200G,8
GH FRUIT N NUT MX DRY FRUIT PP 100g,8
TAAL MAKHANA LOOSE,8
CPL SONA MASOORI NEW RICE 25K,8
RICE DUBRAJ LOOSE,8
MAIDA LOOSE,8
GH RICE BROWN BASMATI 1kg,8
GH ROASTED MAIZE RAWA PP 500g,8
NILGIRIS BASIL SEED JR 100g,8
GH MAIZE 200g,8
PH CHANA MAUSAMI PP 500g,8
NEWRICE INDRAYANI LOOSE,8
GH DAILY OTH PULSE MASOOR DAL STD 2K,8
WHEAT LOKWANBG 10Kg,8
GH CASHEWS 425g + SAFFRON 0.05g GP,8
JEERSAR KANKI LOOSE,8
KARMIQ BLACK SEEDLESS RAISIN PP 100g,8
KOLAM PAKKA LOOSE,8
GH WHO SPICE JAVAS PP 500g,8
AKHROT WHOLE LOOSE,8
RAW RICE RED LOOSE,8
SANGIS KITCHEN BHARWA MASALA BX 100g,8
GH WHO SPICE RED CHILLI 50g,8
PH CHAT CHANA PP 500g,8
GH PONNI STEAM RICE DELUXE BG 25Kg,8
RICE BHAGALPURI KATARNI LOOSE,8
GH RR MISAL KIT PP 90g,8
GH SONA MASOORI RICE ECONOMY BG 25Kg,8
HMT KOLAM NEW STD LOOSE,8
GH RAW RICE IDLI 5K,8
GH DRY FRUIT FLVD PISTACHIO 400g GP,8
SANGIS KITCHEN WHITE ROCK SALT PP 200g,8
GOLDEN HARVEST CASHEW 2P 500g,8
JEERASAR PREMIUM RICE LOOSE,8
CHIDWA LOOSE,8
WHEAT SHARBATI TOPAZ BAG 10KG,8
NAVRATNA DAL LOOSE,8
GOLDEN HARVEST PREMIUM ALMONDS PP 1KG,8
CHANA KABULI 500g,8
SANGIS KITCHEN FISH MASALA BX 50g,8
NILGIRIS FOXTAIL MILLET THENAI PP 500g,8
GH SONA MASOORI RICE SUPREME BG 10Kg,8
GH RICE BASMATI KHICHADI PP 2kg,8
EKTAA JAGGERY SNF & TIL JR 250g + 50g,8
RICE RAW SWARNA LOOSE,8
GH DAILY OTH PULSE NAVRATNA DAL 1K,8
NILGIRIS GINGELLY OIL PP 1L,8
GH DAILY WHOLE DAL HORSE GRAM 500g,8
GH RICE DEHRADUN BASMATI 2kg,8
SONA MASOORI ECONMY LOOSE,8
PH WHO SPICE PANCH PURAN PP 100g,8
GH WATANA WHITE 200g,8
SANGIS KITCHEN BLACK SALT PP 200g,8
RCE BOILED USNA SHRBT STD LOOSE,8
MINIKET STANDARD BOILED RICE LOOSE,8
RICE CHINOR LOOSE,8
GH BASMATI RICE STANDARD 5kg,8
GH RAW RICE RED 1kg,8
GH MASOOR DESI 500g,8
GH WHO SPICE MUSTARD DAL 200g,8
RICE AMBAMOHAR STD NEW LOOSE,8
GH POWDER SPICE BLACK PEPPER PP 200g,8
BN20RAW RICE LOOSE,8
GH POHA THICK 2K,8
RICE KOLAM PREMIUM LOOSE,8
DESI ATTA COM FASTING ASSORTED 4*200g OP,8
AGRIPURE MATTA UNDA RICE 5kg,8
GH DRY FRUIT FRUITS& NUTS 400g GP,8
WATANA WHITE PP 2Kg,8
MAIDA 2Kg,7
TEJ PATTA LOOSE,7
GH DATES DRY 100g,7
WHEAT SHARBATI TOPAZ LOOSE,7
BOILED RICE WHITE GIDDA PREMUM LOOSE,7
WHEATMP LOKWAN RUBY 30Kg,7
AGRIPURE MATTA UNDA RICE 10kg,7
SAGO SMALL LOOSE,7
GH DAGDI CHIWDA POHA 200g,7
RICE KALAM KATI LOOSE,7
RICE INDRANI LOOSE,7
TUR DAL OILY MADHI LOOSE,7
NILGIRIS MILLET RAGI DOSA PP 400g,7
GH FRUIT N NUT ANJEER STANDARD 200g,7
AGRIPURE MATTA VADI RICE 5kg,7
RICE MINI KOLAM STANDARD LOOSE,7
URAD WHOLE 2Kg,7
WH RAJMA KASH RED BIG LOOSE,7
MASOOR DAL SPLIT LOOSE,7
RICE PALAKD MATTA SNG BLD LOOSE,7
PROSO MILLET LOOSE,7
ARWA KATARNI PREMIUM LOOSE,7
GH RICE BASMATI KHICHARI PP 5kg,7
BOILED RC N SANKAR PREM LOOSE,7
KISMIS PREMIUM LOOSE,7
GOLDEN HARVEST ALMOND BLISTER 400g,7
GH RICE (BOILED) LAXMI BHOG PP 5kg,7
DRY FRUIT AMALA SWEET LOOSE,7
GH RR DAL MAKHNI KIT PP 135g,7
BOILED BALAMI RICE LOOSE,7
GH DAILY RAVA/SUJI CHIROTI 500g,7
GH WHO SPICE GONDH DINK 50g,7
WHEAT ATTA SAMPOORNA PP 5Kg,7
SARVOTAM ECONOMY LOOSE,7
RICE PONNY BOILED REGULAR LOOSE,7
KARMIQ GOLDEN GRACE DFT GIFT BX 200g,7
BOILED RC CHNKL PETTU SNG LOOSE,7
GH WHO SPICE DHANIA LOCAL PP 200g,7
ATTA WHOLE WHEAT LOOSE,7
AGRIPURE RICE BOILED MINIKET 10Kg,7
GH RICE AMBEMOHAR PP 5kg,7
GH DAILY TUR DAL RATIO 5K,7
BOILED RICE JAYA DOUBLE LOOSE,7
GH BOILED RICE SELLA DESH 25Kg,7
GH SONA MASOORI RICE PREMIUM BG 25Kg,7
GH WHO SPICE GARAM MSL 25g,7
GH RAGI WHOLE 5kg,7
GH POHA MAKAI PP 200G,7
GOLDEN HARVEST GURBANDI GIRI 100g,7
KARMIQ RSTD & SALTED MIXED NUTS JR 750g,7
GH SONA MASOORI RICE STANDARD BG 25Kg,7
RED CHANA PP 2Kg,7
GH BASMATI RICE HAR ROJ MOGRA 25kg,7
BASMATI RICE TUKDA LOOSE,7
GH BASMATI GOVINDBHOG SUPREME 5kg,7
KAJU CHILKA LOOSE,7
GH RICE KOLAM SUPREME 25Kg,7
GH PONNI RAW RICE SUPREME BG 25Kg,7
LACHKARI KOLAM RICE,7
NILGIRIS FLAX LINSEED POWDER 180g,7
DRY FRUIT KAJU SALTED WHO LOOSE,7
BLACK KISHMIS LOOSE,7
MASOOR WHOLE BLACK 500g,7
EKTAA SABUDANA NYLON PP 500g,7
GH CHANA RED BIG 1K,7
GH RR NAVRATNA DAL KIT PP 100g,7
GH SONA MASOORI SINGLE POLISH RICE 5Kg,7
GH RICE RASOI KI RANI PP 5kg,7
GH RAJMA CHAKROTA DISCO PP 500g,7
SANGIS KITCHEN MUSTARD SMALL PP 100g,7
GH ALMONDS 450g + 0.05g SAFFRON GP,7
PH RAJMA CHITRA PP 500g,7
SAUNF SMALL LOOSE,7
GH GROUNDNUT RED PP 1kg,7
CHANA RED SMALL LOOSE,7
GH PONNI BOILED RICE STD 20Kg,7
MOTHER EARTH WHOLE WHEAT CHAKKI ATTA 1kg,7
GOLDEN HARVEST KISHMIS BLISTER 450g,7
SHAHI JEERA LOOSE,7
RICE BASMATI NEW DUBAR LOOSE,7
GH MATTA SINGLE BOILED RICE 20Kg,7
RATNA SUPREME BOILED RICE LOOSE,7
PH WHO SPICE WHITE TIL PP 100g,7
GOLDEN HARVEST CASHEW 4P 500g,7
SOYA CHUNK LOOSE,7
NYLN TIL LOOSE,7
GH DAILY MAIDA 500g,7
GH RICE BPT PP 5kg,7
BARBATI LOOSE,7
RICE BASKATI PREMIUM LOOSE,7
DAILY SONA MASOORI RICE LOOSE,7
PH MOONG WHOLE GREEN PP 1Kg,7
INDRAYANI KANI RICE BG 20Kg,7
URAD CHILKA 1Kg,7
GH POP CORN SEEDS PP 200g,7
KAIMA RICE STD LOOSE,7
SMALL MUSTD LOOSE,7
GOLDEN HARVEST HAZELNUT 100g,7
GH SONA MASOORI RICE PREMIUM BG 10Kg,6
BIG SAUNF LOOSE,6
GH WHO SPICE TAMARIND CUBE 500g,6
RICE BORA PREMIUM LOOSE,6
RICE MASOORI NEW LOOSE,6
GH JAGGERY CUBES 500g,6
SANGIS KITCHEN SAMBHAR MASALA BX 100g,6
RICE BASMATI DOON PREMIUM LOOSE,6
GH RAW RICE KATARNI PREMIUM 5kg,6
RICE DEHRADUN AKHA LOOSE,6
GH RR LEMON RICE KIT PP 135g,6
RICE BOILED SELLA DESH LOOSE,6
GEV KRISHNA BHOG RICE LOOSE,6
RICE DUDHMALI PARIMAL LOOSE,6
RAW RICE NEW NASIK GHOTI LOOSE,6
PONNI RAW RICE SUPREME LOOSE,6
EKTAA SOYA WADI PP 1Kg,6
WHEAT KOTA FARMI 1482 LOOSE,6
BUSTAAN MUSK MELON SEEDS 100g,6
GH DRY FRUIT MIXED 300g,6
MOTHER EARTH MOONG WHOLE GREEN PP 1Kg,6
AGRIPURE SUREKHA RICE 5kg,6
RED STM CHIL LOOSE,6
GOLDEN HARVEST TARBUJ SEED 50g,6
GH JAGGERY CUBE 500g,6
INDRAYANI RICEBG 20Kg,6
PUNJAB BASKATIBOILED RICE LOOSE,6
GH LAPSI DALIA SMALL 1kg,6
WADA KOLAM RICEPP5Kg,6
PONNY RAW RICE STANDARD LOOSE,6
GH DAILY OTH PULS MASOOR DAL PREMIUM 2k,6
GOLDEN HARVEST CASHEW BROKEN PP 200g,6
COP LOOSE BOILED RICE SUREKHA STD LOOSE,6
GH MAIDA PP 5Kg,6
PANCH PHORN LOOSE,6
GH SAGO SMALL 200g,6
GH DRY FRT 4 GIFT BOX 160g,6
MASOOR MALKA RED 1Kg,6
GH WHO SPICES RADHUNI 100g,6
KARMIQ MAJESTIC CLBRTN DFT GIFT BX 280g,6
GH DAILY RAVA BOMBAY 500G,6
GH OTH FLOUR SATTU 500g,6
GH RR PANCHRATNA DAL KIT PP 95g,6
BASMATI RICE ASIANA LOOSE,6
GH JUWAR PREMIUM 500G,6
MOTH MATKI PP 2Kg,6
GH R&S PISTACHIOS 350g+0.05g SAFFRON GP,6
RAW RICE HAND POUND LOOSE,6
GH DAILY MASR PRM+MNG M S+CHN ST500g OP,6
SHAKARCHINI RICE LOOSE,6
RAW RICE PREMIUM IR8 LOOSE,6
GH DAILY TUR DAL SUPREME 500g,6
RICE LOVELY SILKY LOOSE,6
COP LOOSE BOILED RICE CHERUMANI DOUBLE,6
NILGIRIS GINGELLY OIL PP 500ml,6
GH JAGGERY CUP 800g,6
DAILY IDLY RICE LOOSE,6
RAJABHOGAM RICE LOOSE,6
GH DAILY URAD DAL CHILKA 200g,6
TUR DAL LATUR LOOSE,6
PH MOONG WHOLE GREEN PP 500g,6
KARMIQ ROYAL TREASURES DFT GIFT BX 400g,6
GH CHIWDA THIN 1kg,6
BOILED RICE DOPPI SINGLE LOOSE,6
GH BANDHANIHINGBT 25G,6
NILGIRIS MILLET RAGI IDLI PP 400g,6
MOONG CHILKA 500g,6
GH RICE RASOI KI RANI PP 2kg,6
SANGIS KITCHEN CHOLE MASALA BX 50g,6
RICE CHAWAL MANI LOOSE,6
GH POHA THIN PP 2kg,6
GH WHO SPICE WATERMELN SEED 50g,6
KHUSKHUS LOOSE,6
GH DAILY RAVA/SUJI 2Kg,6
SANGIS KITCHEN GARAM MASALA BX 100g,6
GH GRAM WHITE DOLLAR 500g,6
GH POHA MAKAI FVR 500G,6
RICE GUJRAT KOLAM LOOSE,6
GH SONA MASOORI RICE ECONOMY BG 10Kg,6
EKTAA BHUNA POHA/SIKA CHIWRA 400g,6
BUSTAAN KINGDOM OF DATES KHIDRI 300G,6
PH OTH PULSE FUTANA FRIED 500g,6
GOLDEN HARVEST KHARBUJ SEED 50g,6
RICE KOLAM HMT SILKY LOOSE,6
BASMATI MOGRA RICE BG 10Kg,6
PONNI RICE DELUX  LOOSE,6
GH WHO SPICE DAGAD PHOOL 50g,6
GH WHEAT BROKEN 1K,6
RICE JAYA BOILED LOOSE,6
DESI ATTA CO BAJJI BONDA MIX PP 200g,6
GH MASOOR DAL BADI 200g,6
YELLOW MUSTD LOOSE,6
EKTAA SOYA CHUNKS GRANULES PP 200g,6
COPU RAW RICE NEW SURTI KOLAM BAG 25Kg,6
RICE SONA MASOORI ROYAL LOOSE,6
GH SPICE WHO CHILLI BEDGI 100g,6
GH POWDER SPICE CUMIN PP 200g,6
CHANA KABULI DOLLAR 1Kg,6
CHAWLI RED LOOSE,6
GH MATTA AVAL 500g,6
RICE BASMATI MOGRA LOOSE,6
GOLDEN SELLA DUBAR LOOSE,6
PINENUT SHELLED LOOSE,6
EKTAA JAGGERY CARDAMOM JR 250g + 50g,6
GH PONNI BOILED RICE PREMIUM BG 10Kg,6
SANGIS KITCHEN SAMBHAR MASALA BX 50g,6
SANGIS KITCHEN RAJMA MASALA BX 50g,6
GH RICE RAW INDRAYANI 10kg,6
RICE BASMATI DELHI LOOSE,6
SARVOTAM REGULAR LOOSE,6
RAW RICE CHAMBA LOOSE,6
GH ADDTI & ORG STAP SOY CHUKS 500G,6
GOLDEN HARVER RAJRANI RICE 5kg,6
GH WHO SPICE KARLA 100g,6
GH SUGAR MEDIUM 1Kg,6
CHILEAN WALNUT LOOSE,6
GH MNG STD+RJM JMU+CHANA RD COMBI,5
