,NAME
SANGIS KITCHEN PANCH PHORAN PP 50g,53
GH TUR DAL PREM 500g,52
DESI ATTA CO MEDU VADA MIX PP 200g,50
MOTHER EARTH HAND POUNDED RICE 1Kg,50
GH RICE PULAV 5Kg,50
DESI ATTA CO UPWAS PARANTHA ATTA PP 200g,50
GOLDEN HARVEST CHAKKI FRESH ATTA PP 1K,49
GH WATANA GREEN 500g,49
GH WHO SPICE YELLW MUSTARD 100g,48
FRESH & PURE SUNFLOWER OIL JR 5L,47
GH WHO SPICE GUNTUR CHILLI 100g,47
KARMIQ CASHEW PREMIUM PP 500g,47
DESI ATTA MULTIGRAIN DOSA MIX PP 500g,47
DESI ATTA CO KHAMAN DHOKLA MIX 200g,47
GH POW SPICE CORIANDER PP 200g,47
GROUNDNUT LOOSE,47
DESI ATTA CO RAWA IDLI MIX 500g,47
DESI ATTA KUTTU/BUCKWHEAT  PP 200g,47
GH WHO SPICE MUSTARD BIG 100g,46
GH WHO SPICE CLOVE 50g,46
SANGIS KITCHEN KHUSKHUS WHOLE PP 50g,46
SANGIS KITCHEN MOTIELAICHI WHOLE PP 100g,46
DESI ATTA RICE ATTA PP 1Kg,46
GH LAZEEZ BASMATI RICE PP 5kg,46
GH BANDHANI HING BT 50g,46
GH ATTA 9 GRAIN PP 5Kg,46
DESI ATTA SINGHARA/CHESTNUT PP 200g,46
EKTAA WHEAT DALIYA SMALL PP 1Kg,46
KARMIQ WALNUT WHOLE PP 1Kg,45
GH GROUNDNUT 500g,45
GH WHO SPICE SAUNF SMALL 100g,45
KARMIQ BLK SEEDLESS AFGHN RAISIN TN 100g,45
FRESH&PURE COW GHEE PP 1L,45
MOTHER EARTH BROWN RICE 1Kg,45
GH MATKI WHOLE 500g,45
NATURE CHOICE ROYALE DATES PP 500g,45
DESI ATTA DAHI VADA MIX 200g,44
EKTAA UJJAINI POHA PP 500g,44
GH MAIDA 500g,44
GH URAD DAL CHLK 500g,44
FRESH & PURE SUNFLOWER OIL PP 1L,44
KOSH FLOUR WHEAT OAT ATTA PP 5kg,44
GH BESAN 1Kg,44
KARMIQ WALNUT WHOLE PP 500g,44
GH TEJ PATTA 25g,44
KARMIQ ALMOND PREMIUM PP 500g,44
GH WHO SPICE PANCH PHORAN 100g,43
GH POWSPICECOCONUT 200g,43
DESI ATTA BROWN RICE ATTA PP 200g,43
DESI ATTA BESAN PAKORA MIX PP 200g,43
DESI ATTA URAD DAL PP 200g,43
GOLDEN HARVEST KISMIS INDIAN 500g,43
SANGIS KITCHEN SABJA BASIL SEED PP 50g,43
KARMIQ OLIVE OIL PURE REFINED BT 500ml,43
GH WHO SPICE BIG SAUNF 200g,43
GH POW SPICE KASHM CHILLI 200g,43
GH WHO SPICE BLACK TIL 100g,43
SANGIS KITCHEN CINAMON POWDER BT 37g,43
MOTHER EARTH FENUGREEK 100g,43
DESI ATTA CLASSIC DOSA MIX PP 200g,43
EKTAA NAVSARI POHA PP 1Kg,42
GH WHO SPICE CORIANDER 100g,42
SANGIS KITCHN KASURI METHI PP 25g,42
MOTHER EARTH GROUNDNUT 500g,42
KARMIQ ROSTD & SLTD IRANI PISTA PP 200g,42
KARMIQ IN SHELL PISTA SALTED PP 500g,42
GH WHO SPICE JAVETRI 25g,42
DESI ATTA RICE IDLI MIX PP 200g,42
FRESH&PURE KCHI GHNI MUSTRD OIL BT 500ml,42
GH WATANA WHITE 500g,42
EKTAA GROUNDNUT PP 1Kg,42
SANGIS KITCHEN MOTIELAICHI WHOLE PP 50g,42
GH ROCK SALT PINK PP 200g,42
GH MASOOR DAL BLACK WHOLE 500g,42
GH BANDHANI HING BT 100g,42
EKTAA WHEAT DALIYA SMALL PP 500g,42
SANGIS KITCHEN DRIED GINGER PP 50g,41
SANGIS KITCHEN JAVITRI MACE WHOLE PP 25g,41
KARMIQ ROSTD & SLTD IRANI PISTA PP 500g,41
MOTHER EARTH CINNAMON 100g,41
SANGIS KITCHEN WHITE TIL SESAME PP 200g,41
GH HYDRABADI BIRYANI BASMATI RICE PP 1kg,41
KARMIQ OLIVE OIL EXTRA VIRGIN BT 500ml,41
GH SUGAR 1Kg,41
DESI ATTA THALIPT/MGRN PRTHA MIX PP 200g,41
SANGIS KITCHEN STAR ANISE WHOLE PP 25g,41
DESI ATTA FINE BESAN PP 200g,41
DESI ATTA UPMA MIX PP 170g,41
GH BAJRA STANDARD 1kg,41
FRESH&PURE COW GHEE PP 500ml,41
GH ATTA 9 GRAIN PP 2kg,41
EKTAA MAKAI POHA PP 500g,41
DESI ATTA WHOLE GROATS OATS ATTA PP 500g,41
FRESH&PURE SOYABEAN OIL PP 1L,41
GH LAJAWAAB BASMATI RICE PP 1kg,41
SANGIS KITCHEN CLOVE WHOLE PP 50g,41
GH POW SPICE TURMERIC PP 500g,41
DESI ATTA MOONG WHOLE PP 200g,40
GH POW SPICE TURMERIC 100g,40
EKTAA SOYA WADI BX 200g,40
GH RED MATTA BOILED RICE PP 1kg,40
GH POW SPICE CUMIN 100g,40
GOLDEN HARVEST CASHEW REGULAR 200g,40
DESI ATTA CO BESAN LADOO MIX 200g,40
MOTHER EARTH BASMATI RICE 1Kg,40
DESI ATTA CO PERI PERI IDLI MIX PP 200g,40
GH POW SPC KASHMIRI MIRCH PP 100g,40
MOTHER EARTH POHA 500g,40
MOTHER EARTH SUGAR 500g,40
GH WHO SPICE KHUSKHUS 100g,40
GH BLACK SALT GRNDR BT 100g,40
GH LAZEEZ BASMATI RICE PP 1kg,40
DESI ATTA KHATTA DHOKLA MIX PP 200g,39
GH SALT BLACK 100g,39
DESI ATTA MULTIGRAIN BHATURA MIX PP 500g,39
DESI ATTA MOONG DAL PP 200g,39
EKTAA TAL MAKHANA PP 200g,39
GH SOYABEAN 500g,39
GH BASMATI RICE DIL KHUSH PP 1kg,39
SANGIS KITCHEN BLACK TIL SESAME PP 100g,39
GH BROWN RICE JAR 1Kg,39
KARMIQ IN SHELL PISTA SALTED PP 200g,39
GH POHA THIN 500g,39
EKTAA TAL MAKHANA PP 100g,39
KARMIQ OLIVE OIL EXTRA LIGHT BT 5L,39
GH WHL SPICE WHITE TIL 100g,39
GOLDEN HARVEST SUPREME ATTA PP 1K,39
GH ATTA SUPREME PP 5kg,39
GOLDEN HARVEST CASHEW REGULAR 100g,39
GH PREMIUM SUJI RAVA 500g,39
DESI ATTA CO BEETROOT WHEAT ATTA PP 500g,38
MOONG WHOLE PREM LOOSE,38
MOTHER EARTH FENNEL SEEDS 100g,38
GH AMBEMOHAR RICE PP 1kg,38
EKTAA GROUNDNUT PP 500g,38
GH WHOSPICEBLACKCARDAMM 50g,38
GH SUGAR 5Kg,38
GH PRIME CHANA MAUSAMI PP 1Kg,38
EKTAA WHEAT DALIYA BIG PP 500g,38
RICE SURTI KOLAM PREMIUM LOOSE,38
GH PONNY BOILED RICE PP 1kg,38
DESI ATTA CO RICE ATTA PP 500g,38
DESI ATTA MULTIGRAIN DOSA MIX PP 200g,38
KOSH OATS BROKEN PP 500g,38
MOTHER EARTH BLACK PEPPER 100g,38
SANGIS KITCHEN SAUNF BARIK WHOLE PP 50g,38
GH WHO SPICE TEJ PATTA 50g,38
GH WHO SPICE MUSTARD SMALL 200g,38
URAD DAL PREM LOOSE,38
GH CHAWLI RED 500g,38
DESI ATTA CO BESAN LADOO MIX 500g,38
MOTHER EARTH CHANA DAL 500g,38
GH WHO SPICE GREEN CARDAMOM 50g,38
KARMIQ MAMRA ALMONDS PP 200g,38
SANGIS KITCHEN PANCH PHORAN PP 100g,38
GH CALIFORNIA WALNUT WHOLE PP 500g,38
GH POWDER SPICE TEEKHI MIRCH PP 200g,38
DESI ATTA MOONG PAKORA MIX PP 200g,38
DESI ATTA CO MAKAI ATTA PP 1Kg,38
SANGIS KITCHEN NUTMG POWDER BT 40g,38
DESI ATTA CHANA SATTU PP 500g,38
GH FORTIFIED CHAKKI FRESH ATTA 10Kg,37
GH CHANA DAL PREM 500g,37
GH MOONG DAL PREM 500g,37
MOTHER EARTH URAD DAL 500g,37
SUGAR MEDIUM LOOSE,37
KARMIQ MAMRA ALMONDS PP 500g,37
GH CHANA RED SMALL 500g,37
KARMIQ DRIED BLUEBERRIES 100g,37
TUR DAL STD LOOSE,37
KARMIQ RICEBRAN OIL PP 1L,37
KARMIQ WALNUT SHELLED PP 500g,37
GH POW SPICE CORIANDER PP 500g,37
KARMIQ WALNUT SHELLED PP 200g,37
GH PRIME WHO SPICE YELLOW SARSON 200g,37
GH FRUIT N NUT AKHROT GIRI REGULAR 200g,37
GH POW SPICE DRY GINGER 100g,37
GOLDEN HARVEST KISMIS PREMIUM 200g,37
GH LAJAWAAB BASMATI RICE PP 5kg,37
GH WHO SPICE SHAHI JEERA 50g,37
GH WHO SPICE GREEN CARDAMM 25g,37
GH CHAWLI WHITE LOBHIA 500g,37
DESI ATTA MASUR DAL PP 200g,37
GH POW SPICE RED CHILLI PP 100g,37
SANGIS KTCNKASHMIRICHILLI PWDR PP 200g,37
GH WHO SPICE SAUNF SMALL 200g,37
DESI ATTA RAVA DOSA PP 500g,37
GH POWDER SPICE TEEKHI MIRCH PP 500g,37
GH CALIFORNIA WALNUT WHOLE PP 1kg,37
SANGIS KITCHEN CRDAMOM POWDER BT 37g,37
DESI ATTA COARSE/MOTA BESAN PP 500g,37
KOSH FLOUR WHEAT OAT ATTA PP 1kg,37
SHUBHRA RICESONA MASURI PP 1Kg,36
CHANA KABULI STD LOOSE,36
DESI ATTA THALIPEETH MIX PP 500g,36
DESI ATTA CO THEPLA MIX PP 500g,36
MOTHER EARTH MASOOR WHOLE 500g,36
DESI ATTA CLASSIC DOSA MIX PP 500g,36
SANGIS KITCHEN KALONJI PP 50g,36
RICE IDLI LOOSE,36
GH POW SPICE CHILLI KUTTI 100g,36
GH WHO SPICE KALONJI 100g,36
DESI ATTA RED CHANA ATTA PP 500g,36
GH PRIME CHANA DAL PP 500g,36
SANGIS KITCHEN TEJ PATTA BAYLEAF PP 25g,36
GOLDEN HARVEST KISMIS INDIAN 200g,36
MASOOR DAL PREM LOOSE,36
GH MASOOR DAL BLACK WHOLE 1kg,36
GH TUR DAL  PREM 1kg,36
GH PRIME MASUR DAL PP 500g,36
GH POW SPICE RED CHILLI PP 500g,36
GH TRADITIONAL BASMATI RICE PP 1kg,36
MOTHER EARTH TUR DAL 500g,36
GH PRIME MOONG DAL CHILKA PP 500g,36
KARMIQ ROASTED & SALTED ALMONDS PP 200g,36
DESI ATTA CO KHAMAN DHOKLA MIX 500g,36
MOTHER EARTH MUSTARD SEEDS 100g,36
KARMIQ OLIVE OIL POMACE BT 1L,36
KARMIQ DRY FRUIT PRUNES 100g,36
MOTHER EARTH MOONG DAL 500g,36
GOLDEN HARVEST PREMIUM ALMONDS 500g,36
GH CHANA KABULI PREM 1kg,36
GH PRIME AMARANTH PP 500g,36
SANGIS KITCHEN ANARDANA SABUT PP 50g,36
GH RAJMA CHITRA WHITE 500g,35
SANGIS KITCHEN BYDGI CHILI WHOLE PP 100g,35
GH PRIME WHO SPICE MRCH WHOLE PP 50g,35
GH WHO SPICE CORIANDER 200g,35
GH BADIYAN 50g,35
GH PRIME BLACK RICE PP 500g,35
KARMIQ OLIVE OIL EXTRA LIGHT BT 2L,35
GH SEASONING DILL BT 10g,35
DESI ATTA BHAGAR/SHAMAK/VARAI PP 200g,35
KARMIQ ALMOND PREMIUM PP 200g,35
SANGIS KTCN BALCK PEPPER GRINDER BT 45g,35
POHA THICK LOOSE,35
MOTHER EARTH RAJMA CHITRA 500g,35
GH WHO SPICE KHUSKHUS 50g,35
GH BROWN BASMATI RICE JAR 1kg,35
DESI ATTA RICE IDLI MIX PP 500g,35
GH WHOSPICEWHITETIL 200g,35
DESI ATTA RAVA DOSA MIX PP 200g,35
GH WHO SPICE MUSTARD BIG 200g,35
GH PRIME GROUNDNUT 500g,35
DESI ATTA MAKKI/MAIZE ATTA PP 500g,35
GH POW SPICE CORIANDER PP 100g,35
NATURES CHOICE AMLA CANDY CHATPATI 200g,35
GH PRIME CHANA RED PP 500g,35
GH SEASONING LEMONGRASS BT 15g,35
DESI ATTA RAJGIRA/AMARANTH ATTA PP 200g,35
GH POW SPICE DRY MANGO 100g,35
DESI ATTA FINE/THIN BESAN PP 500g,35
KARMIQ ROASTED FLAX SEEDS JR 200g,35
GH WHO SPICE BIG SAUNF 100g,35
GH WHO SPICE KALONJI 50g,35
NATURES CHOICE DRIED FIGS ANJEER TB 400g,35
RICE STEAM KOLAM LOOSE,35
EKTAA SMALL SABUDANA PP 500g,35
SANGIS KITCHEN AJWAIN WHOLE PP 100g,35
KARMIQ OLIVE OIL PURE REFINED BT 1L,35
GH MOONG DAL CHILKA 500g,35
GH PRIME WHO SPICE BG SAUF 200g,35
DESI ATTA CORN FLOUR PP 100g,35
GH MAIDA 1Kg,35
DESI ATTA MASALA CHAKLI MIX PP 500g,35
MOTHER EARTH LITTLE MILLET PP 500g,35
URAD DAL BLACK WHOLE LOOSE,34
WHEAT SIHORE B LOOSE,34
GH GOVINDBHOG RICE PP 1kg,34
GH PRIME MOTH WHOLE PP 500g,34
KARMIQ DRIED CRANBERRIES 100g,34
DESI ATTA CO OATS IDLI MIX PP 200g,34
EKTAA JAGGERY KOLHAPUR 400g,34
GH WHOSPICETAMARIND 200g,34
HYDRABADI BIRYANI LOOSE,34
SANGIS KITCHEN JAVITRI PP 50g,34
GH PRIME MOONG DAL PP 500g,34
SANGIS KITCHEN METHI DANA WHOLE PP 50g,34
SANGIS KITCHEN PARSLEY BT 7g,34
GH DAILY RAWA IDLI 500g,34
MOONG DAL PREM LOOSE,34
GH FORTIFIED CHAKKI FRESH ATTA 5Kg,34
GH URAD DAL PREM 500G,34
GH PRIME MOONG DAL PP 1Kg,34
GH PINK ROCK SALT GRNDR BT 100g,34
SANGIS KTCN WHITE PEPPER POWDER BT 50g,34
GH PRIME GREN PEAS PP 500g,34
GH SALT SENDHAV 200g,34
KARMIQ DRIED FIGS BX 200g,34
MASOOR DAL STD LOOSE,34
GH PRIME MOONG WHOLE GREEN PP 500g,34
MOONG DAL PREMIUM 2Kg,34
DESI ATTA CO PUTTU PODI PP 1kgg,34
GH SUGAR POWDER 1kg,34
GH WHO SPICE JEERA 200g,34
DESI ATTA ROASTED SUJI PP 1Kg,34
GH WHO SPICE BLK PEPPER 100g,33
GOLDEN HARVEST TARBUJ SEED 100g,33
GH WHO SPICE TAMARIND 500g,33
GH WHO SPICE AJWAIN 100g,33
AGRI PURE RICE LONG GRAIN PP 5kg,33
GH PRIME WHO SPICE WHITE TIL PP 100g,33
EKTAA UJJAINI POHA PP 1kg,33
GH WHO SPICE JEERA100g,33
GOLDEN HARVEST PRIMEQUINOAPP 250g,33
NATURE CHOICE CLASSIQUE DATES 500g,33
MOTHER EARTH CLOVE 50g,33
FRESH&PURE SUNFLOWER OIL REFINED JR 15L,33
GH WHO SPICE DHANADAL 100g,33
SANGIS CARDAMOM SEEDS GRINDER BT 60g,33
DESI ATTA MODAK PP 500g,33
GH CHANA MAUSAMI 500g,33
KARMIQ OLIVE OIL EXTRA LIGHT BT 1L,33
DESI ATTA CO RAWA IDLI MIX 200g,33
SANGIS KITCHEN RED CHILLI FLAKES BT 35g,33
MOTHER EARTH PROSO MILLET PP 500g,33
MOTHER EARTH MASOOR DAL 500g,33
GH BESAN 500g,33
GOLDEN HARVEST CASHEW REGULAR 500g,33
GH WHO SPICE RED CHILLI 100g,33
MOTHER EARTH AJWAIN PP 100g,33
GH SEASONING MARJORAM BT 7g,33
GH WHO SPICE CLOVE 25g,33
GH PRIME URAD DAL PP 500g,33
MOTHER EARTH RAJMA RED 500g,33
SANGIS KTCHN CORIANDER POWDER PP 500g,33
GH PRIME CHAWALI BLCK EYE BEAN PP 500g,33
GH WHO SPICE YELLW MUSTARD 200g,33
GH WHO SPICE CASSIA SPLIT 50g,33
FRESH & PURE KCHI GHNI MUSTRD OIL PP 1L,33
EKTAA SMALL SABUDANA PP 1Kg,33
GH PRIME SOYABEAN WHOLE PP 500g,33
GH WHO SPICE DRY METHI 100g,33
GH POW SPICE BLACK PEPPER 100g,33
SANGIS KICTHEN BLACK MUSTARD PP 100g,33
GH SALT BLACK PP 200g,33
GH PLAIN MAKHANA 100g,33
KARMIQ ROASTED & SALTED CASHEWS PP 200g,33
MOTHER EARTH FOXTAIL MILLET PP 500g,32
DESI ATTA CO SPINACH WHEAT ATTA PP 500g,32
MOTHER EARTH SONA MASOORI RICE 1Kg,32
KARMIQ OLIVE OIL POMACE TN 5L,32
FRESH & PURE KCHI GHNI MUSTRD OIL BT 1L,32
SANGIS KITCHEN KHUSKHUS WHOLE PP 100g,32
EKTAA WHEAT DALIYA BIG PP 1Kg,32
GH WHO SPICE MUSTARD SMALL 100g,32
CHANA DAL 500g,32
GH PRIME URAD WHOLE WHITE PP 500g,32
DESI ATTA NACHNI/RAGI ATTA PP 500g,32
CHANA DAL PREMIUM 2Kg,32
GH SUGAR MISHRI DANA 100g,32
GH KULTHI WHOLE 500g,32
GH RR BISI BELE BHATH KIT 270g,32
GH PRIME CHAWALI BLCK EYE BEANS PP 1Kg,32
GH WHO SPICE KASURI METHI 50g,32
DESI ATTA DEFATD TOASTED SOYA ATTA 500g,32
GH POW SPICE RED CHILLI PP 200g,32
GH RICE BASMATI DIL KHUSH 5Kg,32
GH POW SPICE TURMERIC PP 200g,32
GH POHA THICK 500g,32
EKTAA JAGGERY KOLHAPUR 800g,32
GH PRIME WHO SPICE KHUS KHUS 50g,32
GH CHANA KABULI PREM 500g,32
MOONG DAL STD LOOSE,32
TUR DAL PREM LOOSE,32
GH RICE BASMATI HYDERABADI BIRYANI 5kg,32
GH SEASONING ROSEMARY BT 28g,32
GH PRIME CHANA RED PP 1Kg,32
GH PRIME JASMINE RICE PP 500g,31
SANGIS KITCHEN SAGE SPRINKLER BT 4g,31
GOLDEN HARVEST CHIRONJI PP 100g,31
GH PRIME CHAT CHANA PP 500g,31
KARMIQ GRN RAISIN AFGHAN RAISINS PP 100g,31
MOTHER EARTH CARDAMOM 50g,31
GH PRIME WHO SPICE BLACK SARSON 200g,31
GH PRIME CHANA MAUSAMI PP 500g,31
GH POW SPICE GARAM MASALA 100g,31
GH SUGAR SUPERFINE JAR 1Kg,31
GH WHO SPICE CORIANDER 500g,31
GH PRIME BROWN RICE BASMATI PP 500g,31
GOLDEN HARVEST PREMIUM ALMONDS 200g,31
GH PREMIUM SUJI RAVA 1Kg,31
DESI ATTA SABUDANA PP 200g,31
MOTHER EARTH MOONG WHOLE GREEN 500g,31
GH PRIME CHANA GREEN PP 500g,31
COCONUT LOOSE,31
GH PRIME WHO SPICE METHI DANA 200g,31
GH WHO SPICE GARAM MSL 100g,31
SANGIS KITCHEN WHITE TIL SESAME PP 100g,31
EKTAA NAVSARI POHA PP 500g,31
EKTAA KHEER SABUDANA PP 500g,31
GH WHO SPICE TURMERIC 100g,31
GH URAD DAL WHO BLACK 500g,31
DESI ATTA FLOUR JAU ATTA PP 200g,31
GH POW SPICE KUTTI CHILLI 500g,31
GOLDEN HARVEST ALMND + CASHEW+KISMS 300g,31
GH PRIME MASOOR WHOLE PP 1Kg,31
URAD DAL SPLIT LOOSE,31
GH PRIME BARNYARD MILLET PP 500g,31
MOTHER EARTH RED CHANA 500g,31
GH WHO SPICE DRY METHI 200g,31
GOLDEN HARVEST PREMIUM CASHEW 200g,31
KARMIQ RICE BRAN OIL JAR 5L+1L,30
EKTAA CRL UJJAINI POHA 1kg+POHA 500g OP,30
DESI ATTA ROASTED SOOJI/RAVA PP 500g,30
KARMIQ CASHEW PREMIUM PP 200g,30
GOLDEN HARVEST PREMIUM ALMOND 100g,30
SHUBHRA RICE BROWN SONA MASURI PP 1Kg,30
GH RAJMA SHARMILI RED SML 500g,30
SANGIS KITCHEN BLACK PEPPER PP 100g,30
DESI ATTA CO PUNJBI MS ROTI ATTA PP 500g,30
GH PRIME LAPSI DALIYA SML 500g,30
KARMIQ SAFFRON PRSIAN PP 0.5g,30
AMERCIAN ALMONDS LOOSE,30
GH WHO SPICE GARAM MSL 200g,30
GH PRIME WHO SPICE BLK MUST 100g,30
GH WHOSPICEBLKPEPPER 50g,30
GH PRIME TUR DAL PP 500g,30
SANGIS KITCHEN DRY GARLIC GRINDER BT 40g,30
GH IDLI RICE PP 1kg,30
GH PRIME RAJMA KASHMRI PP 500g,30
KARMIQ DRY FRUIT APRICOTS 100g,30
GH WHO SPICE JAIPHAL 20g,30
MOTHER EARTH MOONG CHILKA 500g,30
MOTHER EARTH CUMIN SEEDS 100g,30
MOTHER EARTH CORIANDER SEEDS 100g,30
GH WHO SPICE AJWAIN 200g,30
SANGIS KITCHEN AMLA POWDER BT 55g,30
GH RAJMA KASHMIRI RED BIG 500g,30
GH PRIME WHO SPICE METHI 100g,30
GH POW SPICE ROYAL GARAM MASALA PP 50g,30
SANGIS KITCHEN BARIK SAUNF PP 100g,30
GH WHOSPICEJAIPHAL 50g,30
GH MOONG DAL  CHILKA 1kg,30
SANGIS KITCHEN MARJORAM SPRINKLER BT 5g,30
MOTHER EARTH RED CHILLI WHOLE 100g,30
MOTHER EARTH URAD WHOLE BLACK 500g,30
GH MOONG WHOLE PREM 1kg,30
GH PRIME MASUR DAL PP 1Kg,30
DESI ATTA CO BAJRA ATTA PP 500g,30
SANGIS KITCHEN YELLOW MUSTARD PP 200g,30
WHEAT LOKWAN A LOOSE,29
GH PRIME MASOOR WHOLE PP 500g,29
TUR DAL STD 5kg,29
GH PRIME WHO SPICE KSHMIRI MIRCH PP 50g,29
SANGIS KTCN KASHMIRI CHILLI PwDR PP 500G,29
SANGIS KITCHEN GINGER GARLIC MIX BT 42g,29
KARMIQ MNCS ALMOND CLASIC CHEESE PP 18g,29
QUINOA WHITE LOOSE,29
GH GROUNDNUT 1kg,29
GH MASOOR DAL PREM 500g,29
GH WHO SPICE KHUSKHUS 200g,29
MOTHER EARTH KABULI CHANA 500g,29
GH MASOOR DAL STD 500g,29
GH PANI PURI MASALA JR 75g,29
GH PRIME WHO SPICE JEERA 100g,29
MOTHER EARTH BARNYARD MILLET PP 500g,29
GH WHO SPICE KASHMR CHILLI 100g,29
GOLDEN HARVEST DRY APRICOT 200g,29
GH FRUIT&NUT PISTA PLAIN PP 200g,29
GH CHAWLI WHITE 1kg,29
GH KURMURA ROASTED 200g,29
SANGIS KITCHEN PAPRIKA BT 35g,29
GH PRIME GREN CARDAMOM JAR 90g,29
SANGIS KITCHEN GREEN ELACHIWHOLE PP 100g,29
GH RICE BASMATI SUPER 5Kg,29
EKTAA SABUDANA POHA PP 200g,29
FRESH & PURE DESI GHEE BX 1L,29
GH RICE KOLAM HMT REGULAR 10kg,29
GH RR NAVRATNA DAL KIT 195g,29
GH SOYA VADI BIG PP 200g,29
GH URAD DAL CHILKA 1kg,29
GH PRIME URAD WHOLE BLACK PP 500g,29
GH PRIME WHO SPICE MUSTARD 100g,28
GH BASMATI RICE CHABBI 1121 5 kg,28
KOSH OATS BROKEN PP 1kg,28
PH GREEN CARDAMOM JAR 90g,28
SANGIS KCN TEEKHI CHILLI PWDR PP 100g,28
EKTAA JAGGERY SAUNF & TIL JR 250g,28
GH SEASONING MINT BT 7g,28
GH PRIME KODO MILLET PP 500g,28
SANGIS KITCHEN JEERA POWDER BT 40g,28
GH KURMURA ROASTED 500g,28
GH PRIME RAJMA SHARMLI PP 500g,28
GH BLACK PEPPER POWDER BT 60g,28
GH URAD DAL PREM 1KG,28
GH BASMATI RICE SUPER PP 1kg,28
GH CASHEW REGULAR 400g,28
GH SABUDANA SMALL 1kg,28
KARMIQ OLIVE OIL EXTRA VIRGIN BT 1L,28
GH SOUTHERN DELIGHT SPICES BX 200g,28
WHEAT LOKWAN B LOOSE,28
GH SALT BLACK 50g,28
SANGIS KITCHEN GREEN ELACHI WHOLE PP 50g,28
GH RR LEMON RICE KIT 270g,28
GH WHO SPICE MUSTARD SMALL 500g,28
EKTAA JAGGERY AJWAIN JR 250g,28
GH WHO SPICE PRM TAMARIND 500g,28
GH PRIME WHO SPICE THN SUF 100g,28
GH JAGGERY ROUND 500g,28
GH POW SPICE ROYAL GARAM MASALA PP 100g,28
GH CHANA KABULI 500g,28
SANGIS KTCHN TURMERIC POWDER PP 200g,28
SANGIS KTCN TEEKHI CHILLI POWDER PP 500g,28
CHANA RED LOOSE,28
GH SUGAR 2Kg,28
GH POW SPICE KUTTI CHILLI 200g,28
PULAV RICE LOOSE,28
GH OTH FLOUR RAGI 500g,28
GH PRIME URAD CHILKA PP 500g,28
RICE DOSA LOOSE,28
GH MOONG WHOLE STD 500g,28
SANGIS KITCHEN ROSEMARY BT 10g,28
FRESH & PURE KCHI GHNI MUSTRD OIL JR 5L,28
GH PRIME WHO SPICE BG SAUF 100g,28
GH MOONG DAL PREM 1KG,28
GH RR SAFFRON RICE KIT 380g,27
GH PRIME KABULI CHANA PP 1Kg,27
CHANA KABULI PREM LOOSE,27
BARNYARD MILLET LOOSE,27
GH URAD DAL WHO BLACK 1kg,27
GH WHO SPICE BADIYAN 25g,27
GH PULAO BASMATI RICE PP 1kg,27
GH PRIME WHO SPICE CINAMON 50g,27
GH PRIME YELOW PEAS PP 500g,27
SANGIS KITCHEN PASTA SEASONING BT 35g,27
GOLDEN HARVEST PREMIUM CASHEW 500g,27
GH POW SPICE EATING SODA 100g,27
KARMIQ ALMOND VAL PP 500g,27
RICE STEAM BASMAT PREMIUM LOOSE,27
GH MOONG WHO STD 1K,27
GH FRUIT N NUT BALCK KISMIS PP 100g,27
GH RICE BASMATI MINI MOGRA 10kg,27
SANGIS KITCHEN KSHMRI CHILIWHOLE PP 50g,27
GH PRIME WHO SPICE GRN CRDM 50g,27
GH RAJMA JAMMU 500g,27
GH WHO SPICE ALSI 100g,27
GH PRIME KABULI CHANA PP 500g,27
RICE SONA MASOORI SUPREME LOOSE,27
GH POHA THIN 1kg,27
NATURES CHOICE AMLA CANDY JALJEERA 200g,27
GH CHANA KABULI STD 500g,27
SANGIS KTCN RED CHILLI FLAKES RFP PP 35g,27
GH SEASONING THYME BT 10g,27
GH BASMATI RICE MOGRA 10Kg,27
GH WHO SPICE DRY GINGER 50g,27
GH WHITE ROCK SALT GRINDER BT 100g,27
SANGIS KITCHEN BADI SAUNF PP 100g,27
GH WHOLE SPICE KASURI METHI BX 25g,27
MOTHER EARTH COWPEA CHAWLI PP 500g,27
GH PRIME WHO SPICE BG CLOVE 50g,27
GH JAGGERY ROUND 1Kg,27
GH CHANA ROASTED PP 200g,27
GH PRIME WHO SPICE GARAM MASALA PP 100g,27
GH SPICES BLACK PEPPER POWDER PP 50g,26
GH JUWAR PREMIUM 1kg,26
MOTHER EARTH BROWN SUGAR PP 500g,26
GH WHO SPICE JAVETRI 50g,26
GH POHA THICK 1kg,26
SANGIS KTCHN TURMERIC POWDER PP 100g,26
GH PRIME WHO SPICE JVITRI PP 50g,26
TUR DAL PREMIUM 2Kg,26
DEHRADUN RICE LOOSE,26
GH CHANA MAUSAMI 1kg,26
GH PRIME LAPSI DALIYA BIG 500g,26
SANGI'S KITCHEN BASIL BTL 5 G,26
GH MIX DAL 1kg,26
GH PRIME WHO SPICE AJWAN 100g,26
GHPR URAD DAL PP 500g,26
GH SOYABEAN WADI 200g,26
TUR DAL SUPREME LOOSE,26
SANGIS KITCHEN METHI DANA PP 200g,26
SANGIS KITCHEN PIZZA SEASONING BT 40g,26
GH SURTI KOLAM RICE PP 1kg,26
CHANA KALA 2 kg,26
GH WHO SPICE BYADGI CHILLI 200g,26
LONG GRAIN LOOSE,26
MIX DAL LOOSE,26
KARMIQ RAISIN INDIAN PP 500g,26
GH WHO SPICE BLACK CARDAMOM PP 25g,26
MOONG DAL 500g,26
GH LAPSI DALIA BIG 500g,26
GH DAHI MASLA JR 75g,26
GH PRIME RAJMA CHTRA PP 500g,26
GH PRIME CHANA DAL PP 1Kg,26
NACHANI LOOSE,26
SONA MASOORI PREMIUM LOOSE,26
GH SALT SENDHAV 100g,26
RICE KOLAM HMT STANDARD LOOSE,26
GH PRIME MOONG DAL CHILKA PP 1Kg,26
FOXTAIL MILLET LOOSE,26
GH FRUIT N NUT KISMIS AFGAN PP 200g,26
DESI ATTA CHIROTI RAVA PP 500g,26
GH PRIME RAJMA CHTRA PP 1Kg,25
GH PRIME FINGER MILLET PP 500g,25
CHANA KABULI 2 kg,25
GH TAL MAKHANA 50g,25
GH PRIME WHO SPICE CORIANDR 100g,25
SANGIS KTCN CORIANDER PWDR PP 200g,25
GH NAWAB PASAND RICE PP 1kg,25
GHPR CHANA RED PP 1Kg,25
DESI ATTA IDLI RAVA PP 1Kg,25
PREMIUM RICE LOOSE,25
GH WHO SPICE MUSTARD BIG 500g,25
GH WHO SPICE KASURI METHI 100g,25
BROWN FLAX SEEDS LOOSE,25
GH PRIME SABUDANA 500g,25
GOLDEN HARVEST DRY APRICOT 500g,25
TUR DAL PREMIUM 5kg,25
GH WHOSPICEBLKCARDAMOM 100g,25
CHANA DAL 1Kg,25
KARMIQ MUNCHIS ALMOND PERI PERI PP 18g,25
GH PRIME TUR DAL PP 1Kg,25
GOLDEN HARVEST KHARBUJ SEED 100g,25
GH RAJMA CHITRA WHITE 1kg,25
GH POWDER SPICE TEEKHI MIRCH PP 100g,25
KARMIQ MNCS ALMOND CHT MASALA PP 18g,25
KARMIQ OLIVE OIL POMACE JR 5L,25
BROWN RICE LOOSE,25
DUBAR PREMIUM LOOSE,25
GH KISMIS PREM 500g,25
GH POW SPICE SUPER GARAM MASALA PP 100g,25
KARMIQ MUNCHIES CSHW CLS CHEESE PP 18g,25
SANGIS KITCHEN CINNAMON WHOLE PP 50g,25
RICE MASOORI LOOSE,25
GH PREMIUM DALIYA 500g,25
EKTAA JAGGERY PREMIUM JR 250g,25
GH SEA SALT GRINDER BT 100g,25
GH BPT RICE PP 1kg,25
GH PRIME LITTLE MILLET PP 500g,25
SANGIS KITCHEN GARAM MSLA WHOLE PP 100g,24
SANGIS KITCHEN DAHI MASLA BT 45g,24
GH MOONG WHOLE PREM 500g,24
RICE AMBAMOHAR PREMIUM LOOSE,24
MASOOR BLACK WHOLE LOOSE,24
GH PRIME WHO SPICE CARDAMOM BG 100g,24
GH PRIME PEARL MILLET PP 500g,24
SANGIS KITCHEN BLACK MUSTARD PP 200g,24
MOONG DAL 1Kg,24
CORN LOOSE,24
RICE KOLAM SUPREME LOOSE,24
MATKI LOOSE,24
MOTHER EARTH URAD CHILKA 500g,24
GHPR MASOOR WHOLE PP 500g,24
SANGIS KITCHEN BLK PEPPER POWDER BT 40g,24
SANGIS KTCN TEEKHI CHILLI PWDR PP 200g,24
SANGIS KICTHEN METHI DANA PP 100g,24
GH PRIME URAD DAL PP 1Kg,24
CHANA DAL STD LOOSE,24
GH BUTTERMILK MASALA JR 100g,24
GH CHANA RED SMALL 1K,24
GH SABUDANA SMALL 500g,24
SANGIS KTCN BANDHANI HING GRINDER BT 50g,24
MINI MOGRA LOOSE,24
SANGIS KITCHEN DILL SPRINKLER BT 6g,24
GH PRIME WHO SPICE PANCH PURAN PP 100g,24
KODO MILLET LOOSE,24
TUR DAL ECONOMY LOOSE,24
RAW RICE NEW LUCHAI LOOSE,24
RAJGIRA WHITE LOOSE,24
SANGIS KITCHEN CORIANDER WHOLE PP 100g,24
RICE LAL PATNI LOOSE,24
GH WHITE PEPPER POWDER BT 70g,24
SHUBHRA RICESONA MASURI PP 5Kg,24
GH SUGAR POWDER 500g,24
GH WHO SPICE SHAHI JEERA 100g,24
EKTAA KURMURA PP 200g,24
GHPR MOONG DAL PP 500g,24
GHPR CHAWALI BLCK EYE BEAN PP 500g,24
GH FRUIT&NUT MIX DRY FRUIT PP 200g,24
TAMARIND LOOSE,24
GH LAPSI DALIA SMALL 500g,24
GH SABUDANA BIG 500g,24
GOLDEN HARVEST PISTA PISHORI 100g,23
GH PRIME URAD CHILKA PP 1Kg,23
GH WHO SPICE COCONUT 500g,23
GH SEASONING PARSLEY BT 15g,23
GHPR MOONG DAL CHILKA PP 1Kg,23
KARMIQ CASHEW VAL PP 100g,23
KARMIQ OLIVE OIL EXTRA VIRGIN BT 250ml,23
WHEAT SHARBATI LOOSE,23
GH WHO SPICE CASSIA SPLIT 100g,23
GH SONA MASOORI RICE PP 1kg,23
SANGIS KITCHEN BUTTERMILK MASALA BT 60g,23
GHPR BARNYARD MILLET PP 500g,23
MOTHER EARTH PUFFED RICE 180g,23
RICE ROYAL BASMATI LOOSE,23
CHANA KABULI 1Kg,23
KARMIQ CASHEW VAL PP 400g,23
GH WHO SPICE CLOVE 100g,23
TUR DAL 1Kg,23
GH PRIME MOONG WHOLE GREEN PP 1Kg,23
GH DAILY MOONG DAL PREM 2K,23
RAW RICE AMBEMOUR LOOSE,23
RICE MOGRA STANDARD LOOSE,23
DESI ATTA IDLI RAVA PP 500g,23
GH OTH PULSE MASOOR DAL STD 1K,23
GHPR LAPSI DALIYA BIG 500g,23
GH WHO SPICE BLACK CARDAMM 20g,23
EKTAA JAGGERY CARDAMOM JR 250g,23
GH SANDWICH MASALA JR 75g,23
GH PULSES WHO URAD WHITE STD 500g,23
RED MATTA LOOSE,23
GH WHO SPICE RAI 100g,23
CHANA DAL PREM LOOSE,23
GOLDEN HARVEST KISMIS INDIAN 100g,22
GH POHA 500g,22
KARMIQ ROYAL ALMOND JAR 800g,22
GHPR CHANA MAUSAMI PP 500g,22
GH WHO SPICE JEERA 500g,22
SANGI'S KITCHEN OREGANO BTL 8 G,22
GH WHO SPICE METHI DAL 100g,22
NATURE CHOICE ANJEER PP 200g,22
GH RICE BASMATI HYDERABADI BIRYANI 10kg,22
GOLDEN HARVEST MUNAKKA 100g,22
GHPR MASOOR WHOLE PP 1Kg,22
GH SEASONING BASIL BT 7g,22
NATURES CHOICE AMLA CANDY ANARDANA 200g,22
SANGIS KITCHEN BLACK TIL SESAME PP 200g,22
GH CHANA ROASTED PP 500g,22
GHPR MOONG WHOLE GREEN PP 1Kg,22
EKTAA FTN BHUNA BHUNJA CHANA PP 250g,22
GH DAILY RAWA IDLI 1K,22
GH WHO SPICE ANISE SEED 100g,22
SANGIS KITCHEN BLACK SALT GRNDR BT 100g,22
GH BASMATI RICE DUBAR PREMIUM 10Kg,22
KARMIQ CASHEW VAL PP 200g,22
MOONG WHOLE 2Kg,22
GH BLACK SALT 200g,22
GH WHO SPICE BIG SAUNF 500g,22
GH RICE DOSA RICE 2K,22
GH WHO SPICE DRY METHI 500g,22
SANGIS KITCHEN JALJEERA MASALA BT 45g,22
SANGIS KITCHEN THYME SPRINKLER BT 11g,22
SANGIS KITCHEN MINT SPRINKLER BT 5g,22
RICE KALI MUCH LOOSE,22
SANGIS KITCHEN BADI SAUNF PP 200g,22
GH PLAIN MAKHANA 200g,22
JUWAR PREMIUM LOOSE,22
GHPR CHAWALI BLCK EYE BEANS PP 1Kg,22
GH PRIME WHO SPICE GUNDU CHILI BORE 50g,22
GH RICE LONG GRAIN BAG 5K,22
GH GOLA CUT 200g,21
SUGAR SMALL LOOSE,21
GOLDEN HARVEST CASHEW 4P 200g,21
GH BHAGAR 500g,21
KARMIQ MNCS ALMOND SEAL SLT&PPR PP 18g,21
SANGIS KITCHEN DRY MANGO POWDER BT 40g,21
KARMIQ MNCS CASHEW SEA SLT & PPR PP 18g,21
GH MIX DAL 500g,21
RICE SILKY KOLAM LOOSE,21
WHEAT ATTA 5Kg,21
RICE BASMATI TIBAR LOOSE,21
GH FRUIT N NUT SEEDLES BLACK KISMIS 200g,21
GOLDEN HARVEST DRY APRICOT 100g,21
GH CHANA DALIYA 500g,21
GH SUGAR MISHRI DANA 200gm,21
GHPR URAD WHOLE BLACK PP 500g,21
GH MASOOR DAL PREM 1K,21
TUR DAL 500g,21
BESAN 1Kg,21
KARMIQ OLIVE OIL CLASSIC BT 250ml,21
RAJMA CHTRA WHITE LOOSE,21
GH WHO SPICE PANCH PHORAN PP 200g,21
GUNTR CHILLI LOOSE,21
GHPR CHANA GREEN PP 500g,21
EKTAA JAGGERY PREMIUM JR 500g,21
RICE I R 36 LOOSE,21
BAJRA STANDARD LOOSE,21
GOVIND BHOG PRM LOOSE,21
BAJRA PREMIUM LOOSE,21
GH SUGAR BROWN JAR 800g,21
1014RAW RICE LOOSE,21
GH MATKI WHOLE 1K,21
MOONG WHOLE STD LOOSE,21
RAJMA JAMMU LOOSE,21
GHPR TUR DAL PP 500g,21
GH CHANA DAL PREM 1KG,21
RAW RICE SOLTY RAMPAL LOOSE,21
HMT PRM LOOSE,21
GOLDEN SELLA LOOSE,21
CORIANDER LOOSE,21
KARMIQ RAISIN INDIAN PP 200g,21
GHPR MOTH WHOLE PP 500g,21
GH EVERYDAY DAL MIX PP 500g,21
GH BANDHANI HING BT 2*100g,20
KARMIQ MUNCHIS CASHEW PERI PERI PP 18g,20
GH SEASONING SAGE BT 7g,20
GHPR MASUR DAL PP 500g,20
GHPR RAJMA CHTRA PP 1Kg,20
WAL SURTI LOOSE,20
GH FRUIT N NUT KAJU MASALA CHILLI 200g,20
GH PREMIUM DALIYA 1Kg,20
RAW RICE SHREE AIJAN LOOSE,20
GH POWDER SPICE CORIANDER PP 1kg,20
GH DAILY TUR DAL PREM 2kg,20
GHPR GROUNDNUT 500g,20
GH WAL KADWA WHOLE 500g,20
PH WHO SPICE CARDAMOM BIG 100g,20
GH POW SPICE SUPER GARAM MASALA PP 50g,20
USNA MASOORI STANDARD BOILED RICE LOOSE,20
GH BASMATI RICE DUBAR BG 5Kg,20
CHANA MAUSAMI LOOSE,20
GH PRIME WHO SPICE JEERA 200g,20
CHANA KALA 500g,20
GOLDEN HARVEST KHARIK BLACK PP 100g,20
GHPR MOONG DAL CHILKA PP 500g,20
RICE BASMATI STANDARD LOOSE,20
GH WHOSPICEKALONJI 200g,20
GOLDEN HARVEST PREMIUM CASHEW 100g,20
GH DRY GINGER POWDER BT 50g,20
GH WHO SPICE PANDI CHILLI PP 50g,20
KARMIQ ALMONDS VAL PP 100g,20
