,NAME
IMPORTED TOOR DAL LOOSE,5
GRN CARDAMM LOOSE,5
MIRYALGUDA SONA MASOORI RICE LOOSE,5
DATES DRY LOOSE,5
GH RAGI WHOLE 500G,5
RAMPAL JOHA RICE BG 25Kg,5
GH KAB CHN500+R CHN500+WH WATN500g,5
WALNUT WHOLE LOOSE,5
GH RR MEXICAN RICE KIT PP 120g,5
BUSTAAN WATER MELON SEEDS 100g,5
BADAM MAMRA LOOSE,5
GH DAILY OTH PULSE CHANA DAL PREM 200g,5
KARMIQ RSTD & SALTED MIXED NUTS JR 350g,5
OTH CEREL AVALAKHI MEDIUM LOOSE,5
RICE SAFRI BOILED LOOSE,5
URAD GUNDU PREMIUM PP 500g,5
PONNY RAW RICE SUPREME LOOSE,5
URAD WHOLE 1Kg,5
DRY FRUIT CRANBERRY LOOSE,5
NILGIRIS MILLET RAVA DOSA PP 400g,5
SANGIS KITCHEN TEA MASALA BX 5,5
GH SONA MOONG DAL PP 500g,5
SANGIS KITCHEN TEA MASALA BX 10,5
GH GROUNDNUT RED PP 500g,5
TUR DAL KORI STD LOOSE,5
KARMIQ PURE OPULENCE DFT GIFT BX 600g,5
SANGIS KITCHEN CHAAT MASALA BX 100g,5
APRICOT WHOLE LOOSE,5
CHANA MAUSAMI PP 1Kg,5
Jeera 100g,5
Besan 1kg,5
KARMIQ DRIED CRANBERRIES PP 200g,5
WHEAT SIHORE BG 10Kg,5
GH KURMURA BASMATI 200g,5
GH JAGGERY CUP 400g,5
GH DAILY BESAN PP 2kg,5
GH DAILY RAVA BOMBAY 2KG,5
KITCHEN KHAJANA RICE LOOSE,5
GH RAJMA CHITRA WHITE 200g,5
BADIYAN LOOSE,5
GOLDEN HARVEST PISTA BLISTER 320g,5
KARMIQ BLACK SEEDLESS RAISIN PP 200g,5
RICE MOUNTAIN LOOSE,5
AGRIPURE RICE SONA MASOORI STANDRD 10Kg,5
GH BASMATI KRT BROKEN 25Kg,5
GH MASALA MOORI 100G,5
BASMATI RICE TUKRA BAG 25Kg,5
SANGIS KITCHEN GARAM MASALA BX 50g,5
GH CHIWDA THIN 500g,5
RED CHILLI LOOSE,5
GH KURMURA ROUND 200g,5
SANGIS KITCHEN PAV BHAJI MASALA BX 50g,5
ZINI KOLAM RICE LOOSE,5
SANGIS KITCHEN PAV BHAJI MASALA BX 100g,5
GH DAILY OTH PULSE MATAR DAL 500g,5
JAIPHAL LOOSE,5
NEW RICE IDLI PREMIUM LOOSE,5
CHANA MAUSAMI PP 500g,5
GH FRUIT N NUT IMLI CNDY PP 100g,5
AJWAIN LOOSE,5
GH DRY COCONUT WHOLE PP 200g,5
MOONG WHOLE GOTA LOOSE,5
KALI MOOCH BROKEN LOOSE RICE,5
DRY FRUIT KAJU STANDARD LOOSE,5
GH CHIWDA THICK 1kg,5
RICE JERASAL Z LOOSE,5
WHEAT DARA BAG 10KG,5
Dry Ginger 50g,5
SANGIS KITCHEN RAJMA MASALA BX 100g,5
SANGIS KITCHEN DESICHINESE MASALA BX50g,5
SELLA PRM LOOSE,5
SONAM RAW RICE LOOSE,5
KARMIQ ROASTED SLTD SNFLWR SEEDS BT 100g,5
GH WHO SPICE GARAM MSL 50g,5
MASOORI RICEBG 20Kg,5
GH JAYA BOILED RICE PREMIUM 20Kg,5
GH CHIWDA THICK 500g,5
GH ASSAM JOHA RICE BAG 5Kg,5
EKTAA JAGGERY CANDY JR 500g,5
RICE BASMATI NEW MOGRA LOOSE,5
GH PONNI BOILED STANDARD RICE BG 10Kg,5
BSMT RICE MINI MOGRA BG 20Kg,5
KARMIQ ILLUMINATI DFT GIFT BX 600g,5
GOLDEN HARVEST INSHEL GOLA BADAM PP 400g,5
GH RAJABHOGAM RICE BG 25Kg,5
GH AMARA 200g,5
LITTLE MILLET LOOSE,5
GH WHO SPICE GUNDU CHILLI 200g,5
GH CHANA DAL BADI 200g,5
MOTHER EARTHJAGGERYPOW ORGANIC PP 500g,5
GOLD WINNER VANASPATI PP 1L,5
GH DAILY TUR DAL WHOLE 500g,5
1121 RAW TIBAR BASMATI RICE LOOSE,5
GH IDLI RICE PREMIIUM 5kg,5
GOLDEN HARVEST ALMOND SANORA PP 200g,5
SHREE RAM RAW BROKEN,5
SUGAR CANDY BIG LOOSE,5
GH RICE MASOORI PP 2kg,5
RAW RICE KOLAIGAON AIZWAN LOOSE,5
GOLDEN HARVEST KISMIS AFGAN 500g,5
DESI ATTA RAGI ATTA PP 1Kg,5
BOILED RICE PONNY SUPR LOOSE,5
DRY FRUIT KHARIK YELLOW LOOSE,5
GH WHO SPICE NAKESHWAR 50g,5
BASMATI RICE PUSA BASMATI LOOSE,5
NILGIRIS LINSEED POWDER JAR 250g,5
GH BARBATI 500g,5
GH SUGAR SMALL 1Kg,5
MOTHER EARTH CHANA DAL PP 1Kg,5
AGRIPURE RICE SONA MASOORI PREMIUM 10Kg,5
GH RICE BOILED LAXMI BHOG PP 2kg,5
GH GROUNDNUT INSHELL ROASTED PP 500g,5
KALIDARAKH WITH SEED LOOSE,5
KARMIQ MUNCHIES CASHEW PERI PERI 25g,5
GH POW SPICE KODAMPULI 100g,4
RICE HYDRABADI DUM BIRYNI LOOSE,4
GH JAI SHRI RAM RICE 1 Kg,4
GH RAW RICE SONAM 25Kg,4
GH PRIME SONA MASUR CHATI DAL PP 500g,4
GH RAW RICE JIRASAR PP 5kg,4
KABULI CHANA NEW LOOSE,4
EKTAA JAGGERY POWDER CN 350g +70g OP,4
SANGIS KITCHEN MOTIELAICHI WHOLE PP 25g,4
MOTHER EARTH SONA MASOORI BROWN RICE 1Kg,4
NILGIRIS KODO MILLET VARAGU PP 500g,4
RICE BASMATI TILDA CHAMAK LOOSE,4
Kaju 320 Cnt .,4
GH RICE RAJ RANI KATTA 25kg,4
GH PONNI STEAM RICE DELUXE BG 10Kg,4
GH RR PUNJABI DAL KIT PP 95g,4
AGRIPURE SONA MASOORI CLASSIC RICE 25Kg,4
COP LOOSE BOILED RICE ROSE DOUBLE UNDA,4
COPU JEERASAR REGULAR RICE BAG 25Kg,4
LONG GRAIN RICE BG 25Kg,4
Rajma White 200g,4
TUR DAL WHOLE LOOSE,4
GH WHO SPICE GUNTUR CHILLI 200g,4
WHEAT SHARBATI C AMRIT LOOSE,4
RED CHILLY CASHEW LOOSE,4
GH KALIMUCH RICE 5Kg,4
SANGIS KITCHEN PERI PERI MASALA BX 50g,4
GH BOILED RICE LAXMIBHOG 25kg,4
BOILED RC CHERUMANI DOUBL LOOSE,4
REGULAR PONNI RICE PP 25Kg,4
GH SONA MOONG DAL PP 1Kg,4
DALIYA 500g,4
BOILED RICE DUBAR LOOSE,4
GH RICE BASMATI HARROJ PP 5kg,4
DRIED AMLA LOOSE,4
GH KURNOOL RICE PREMIUM 5Kg,4
DHANA LOOSE,4
KAIMA RICE PREM LOOSE,4
GH RICE BASMATI HARROJ PP 2kg,4
GH RICE (BOILED) MUGHALI BIRYANI PP 2kg,4
GH DAILY URAD DAL MOGRA 500g,4
GUJARAT 70 SONAM LOOSE,4
COP RW RICE KALI MUCH STANDARD LOOSE,4
RICE CHULMANI LOOSE,4
GH CHANOLI 1K,4
CHILLI BYADAGI STEM LOOSE,4
RICE STEAM STANDARD LOOSE,4
KRT BROKEN RICE BG 25Kg,4
KAJU BROKEN SMALL LOOSE,4
KARMIQ MUNCHIES ALMOND PERI PERI PP 25g,4
NILGIRIS QUINOA SEEDS GLUTEN FREE 500g,4
GH RAW RICE HMT KOLAM REG 25K,4
KOSH OATS ATTA PP 500g,4
NILGIRIS APRICOT OIL BT 50ml,4
MOTHER EARTH MOONG DAL PP 1Kg,4
BOILED RICE N SANKAR STD LOOSE,4
JAVETRI LOOSE,4
GH RICE SURTI KOLAM PREMIUM 5Kg,4
GH WHO SPICE DHANADAL PP 500g,4
RICE BASMATI NEW TIBAR LOOSE,4
MAKKA MAIZE LOOSE,4
GH DAILY TUR P+MASOOR P+CHANA P 500g OP,4
SANGIS KITCHEN CASSIA WHOLE PP 25g,4
GH DIAMOND SUGAR CANDY 200g,4
RICE TIBAR BOILED LOOSE,4
GH LAPSI DALIA BIG 1kg,4
GH PONNI RAW RICE PREMIUM BG 25Kg,4
GH OTH FLOUR SATTU PP 2kg,4
MINIKET POPULAR RICE BG 25Kg,4
GH WHO SPICE LIMBU PHOOL 100g,4
GH JAGGERY BUCKET PP 950g,4
GH DIAMOND SUGAR CANDY 100g,4
GH RICE WADA KOLAM SUPREME 25kg,4
RICE 521 PAUNIA ROYAL LOOSE,4
GHPR SONA MASUR CHATI DAL PP 1Kg,4
RICE GIDDA REGULAR LOOSE,4
BYADGI CHILI LOOSE,4
EKTAA RED POHA PP 500g,4
GH RR BISI BELE BATH KIT PP 135g,4
RICE RAICHUR NEW SM LOOSE,4
KURNOOL SONA MASOORI RICE LOOSE,4
KALI MOOCH RICEBG 20Kg,4
RICE PARI SUPREME LOOSE,4
GH JAGGERY POWDER PP 1kg,4
GH DAILY NAVRANG DAL PP 500g,4
ARWA SONACHUR STD LOOSE,4
WHEAT CHAKKI MP SHARBATI LOOSE,4
GH SABUDANA BIG 200G,4
FRESH & PURE SUNFLOWER RFND OIL TN 15L,4
BSMT TAJMAHAL RICE BG 20Kg,4
AGRIPURE RICE SONA MASOORI CLASSIC 10Kg,4
NILGIRIS FLAX LINSEED 200g,4
BASMATI RICE REGULAR NEW LOOSE,4
GH POHA NYLON 200g,4
GH JAGGERY POWDER PP 500g,4
KOLLA RICE STD LOOSE,4
EATING SODA LOOSE,4
GH POW SPIC RED CHIL+TURM+CORNDR 600g OP,4
GH DAILY PLS MOONG DAL KHICHDI MIX 500g,4
GH RR SAFFRON RICE KIT PP 190g,4
RICE SELLA BASMATI MINI MOGRA LOOSE,4
GH ASSAM JOHA RICE BAG 2Kg,4
RAW RICE BERPETA AIJAN LOOSE,4
Mustard Small 100g,4
GH JAGGERY BUCKET PP 450g,4
GH DAILY RAVA IDLI 2KG,4
NILGIRIS MILLET MASALA UPMA PP 140g,4
MOTHER EARTHFLAXSEEDS PP 100g,4
WHEAT SIHORE C LOOSE,4
GH DAILY OTH PULSE MATAR DAL 1K,4
URAD DAL SUPREM LOOSE,4
GH WHO SPICE GUNTUR CHILLI 500g,4
URAD GUNDU PREMIUM PP 1kg,4
GH SABUDANA PP 2kg,4
GH POWDER SPICE DRY GINGER PP 200g,4
JEERA SAMBA STANDARD RICE LOOSE,4
GOLDEN HARVEST ALMOND SANORA PP 100g,4
AGRIPURE RICE SONA MASOORI SUPREME 10Kg,4
ARWA KATARNI STANDARD RICE BG 25Kg,4
GH RAW RICE JEERASAR 10kg,4
KARMIQ ROASTD SLTD PUMPKIN SEEDS BT 100g,4
RICE NEW SONA MASOORI PRM LOOSE,4
EKTAA PAPER POHA/ POHA THIN PP 500g,4
POW SPICE RED CHILLI LOOSE,4
MASOOR MALKA RED 500g,4
GH WHO SPICE GUNDU CHILLI 500g,4
GOLDEN HARVEST SHAKKAR CHINI RICE 5kg,4
MOONG DAL KORI LOOSE,4
GHPR SONA MOONG DAL PP 1Kg,4
GH DAILY TOOR S500g+MNG S500g+CHNA S500g,4
GH KURNOOL RICE PREMIUM 1Kg,4
GH BHAGAR 200g,4
Turdal Prm 500g,4
GH WHO SPICE WHITE TIL 1Kg,4
GH HMT RICE 1Kg,4
CHINNOR PREMIUM LOOSE,4
AGRIPURE RICE BOILED RATNA 10Kg,4
BASMATI RICE MOGRA BG 20Kg,4
GH SLICED ALMONDS JR 95g,4
SANGIS KITCHEN TANDOORI MASALA BX 100g,4
AGRIPURE SONA MASOORI STANDRD RICE 25Kg,3
KARMIQ TRAIL MIX PP 200g,3
GH CHANOLI 500g,3
KARMIQ GRN AFGHAN RAISIN PP 200g,3
GH URAD DAL GUNDU PREM 500g,3
GH WHO SPICE JAVAS PP 200g,3
BALAMI RICE BG 25Kg,3
COPU JEERASAR PREMIUM BAG 25Kg,3
GH WHO SPICE JAVAS 100g,3
RICE KURUVA DOUBLE BOILED LOOSE,3
GH RAW RICE RAMPAL SUNFLOWER 25Kg,3
STEAM KOLAM RICE BG 20Kg,3
RICE SONA MASORI POPULAR STEAM LOOSE,3
WHITE MATAR LOOSE,3
RAW RICE SONA MASORI SPR LOOSE,3
KASHM CHILLI LOOSE,3
BOILED RICE REGULAR LOOSE,3
GH GOBINDO BHOG SUPREME 25k,3
GH COUNTRY SUGAR PP 500g,3
SONA MASOORI STEAM STD LOOSE,3
KARMIQ MUNCHIES CASHEW SEA SALT&PPR 25g,3
BOILED KOLAM LOOSE,3
GHPR SONA MASUR CHATI DAL PP 500g,3
MUSTARD LOOSE,3
PH BASMATI EVERDAY LOOSE,3
BUSTAAN WHOLE PUMPKIN GREEN SEEDS 100g,3
CHANA RED NEW LOOSE,3
Dhaniya 200g,3
GH BOILED RICE MINI KET STD 25k,3
USNA SHARBATI STANDARD RICE BAG 25Kg,3
KARMIQ MUNCHIES ALMOND CHAT MASALA 25g,3
BOILED RICE ASIANA BAG 25kg,3
GOLDEN HARVEST CASHEW REGULAR PP 1Kg,3
RICE SAKKAR CHINI25Kg,3
KARMIQ BERRY MIX PP 200g,3
GH DAILY OTH PULSE PEAS DAL 500g,3
URAD WHOLE 500g,3
RICE PARI STARDARD LOOSE,3
PALM JYOTHI PALMOLEIN OIL PP 1L,3
Urad Round Prm 2kg,3
SONAM RICE BG 25Kg,3
KARMIQ MUNCHIES CASHEW CLASSC CHEESE 25g,3
GUJRAAT JEERASAR NEW LOOSE,3
Khus Khus 50g,3
RAW RICE IDLI BROKEN LOOSE,3
GH RAW RICE SHREE AIJAN 25Kg,3
GH BOILED RICE BASKATI 5Kg,3
RASMALAI PREM JAGGERY PP 900g,3
WHT CARDAMM LOOSE,3
FB SIS PLAIN DRY FRUITS 2,3
GH MASUR DAL CHANTI PP 1Kg,3
GH PALM JAGERRY 400g,3
FB WHO SPICE OREGANO LOOSE,3
SUNFLOWER RAMPAL RICE BG 25Kg,3
GH AVALAKHI THIN 500g,3
HYDRABADI BIRYANI RICE BG 25Kg,3
BUSTAAN WHO SPC BROWN FLAX SEEDS 100g,3
PHOOL KOKAM LOOSE,3
GH BOILED RICE MINI KET SUP 25kg,3
Surti Kolam (Lachkari) 5 kg,3
JEERASAR STANDARD BAG 25Kg,3
KARMIQ MUNCHIES ALMOND CLASSI CHEESE 25g,3
GH POHA AVALAKKI MEDIUM 500G,3
NILGIRIS PONNI RAW RICE PREMIUM 20kg,3
TOOR DAL LOOSE,3
GH SUREKHA BOILED RICE PREMUM 20Kg,3
HMT KOLAM RICE BG 20Kg,3
GH CRYSTAL DRY FRUIT GIFT BOX 270g GP,3
GH RICE RAVA PP 500g,3
GH DAILY RAVA/SUJI CHIROTI 1Kg,3
Ragi 1kg,3
KALI MUCH STANDARD RICE BG 25Kg,3
OPP KOLAM KANNI RICE LOOSE,3
SADHU AIJAN RICE BG 25Kg,3
GOLDEN HARVEST CASHEW 200g+KISMS 200g+AL,3
GH DAILY NAVRANG DAL PP 1kg,3
GH JAI SHRI RAM RICE 5 Kg,3
RICE PONNY BOILED STD LOOSE,3
ARWA SONACHUR PREMIUM RICE BG 25Kg,3
SANGIS KITCHEN CHAAT MASALA BX 50g,3
GH DRY COCONUT WHOLE PP 500g,3
URAD CHILKA 500g,3
Coconut Powder 200g,3
WHEAT SHARBATI D LOOSE,3
SONA MASOORI RICEBG 20Kg,3
GH PONNI RAW RICE SUPREME BG 10Kg,3
KOLLA RICE PREM LOOSE,3
GH RAW RICE SOLTY RAMPAL 25kg,3
SANGIS KITCHEN CLOVE WHOLE PP 25g,3
NILGIRIS MILLET LEMON POHA PP 140g,3
GH THENAI 500G,3
GHD WHO SPICE MONOSODIUM GLUTAMATE 100g,3
VADI MATTA DOUBLE BOILED RICE LOOSE,3
SALTED ALMOND LOOSE,3
COP UNBRANDED KALIMUCH RICE BG 5Kg,3
RICE KALI MUCH BG 25Kg,3
BUSTAAN RAISIN BLACK SEEDLESS 250g,3
RICE SADHU BASMATI LOOSE,3
GH SONA MASOORI SINGLE POLISH RICE 1Kg,3
MATAR DAL PREM LOOSE,3
GH DAILY TUR DAL SUPREME 1kg,3
GH CHANA KABULI DOLLER 2k,3
RICE KOHINOOR BASMATI LOOSE,3
GH KURMURA LONG 200g,3
GH KURMURA ROASTED PP 500g,3
GH BOILED RICE PP 1kg,3
SURTI KOLAM RICE BG 20Kg,3
GH PONNI RAW RICE PREMIUM BG 10Kg,3
MASOORI SPECIAL RICE BG 25Kg,3
GH HAND POUND RICE 5Kg,3
GH SOYABEAN 1K,3
SANGIS KITCHEN FISH MASALA BX 100g,3
RICE RAAJ RANI 25Kg,3
Kabuli Chana Small 500g,3
GH DRY FRUIT KHARIK POWDER 200G,3
GH DAILY RAVA BOMBAY 1KG,3
RAGI STD LOOSE,3
Turdal Prm 2kg,3
GH PONNI BOILED RICE 5Kg,3
RICE MAMA BHANJA DUBAR/MOGRA LOOSE,3
GH PONNI RAW RICE STANDARD BG 10Kg,3
RICE BOILED CHAMARMANI LOOSE,3
COPU RAW RICE WADA KOLAM BAG 25Kg,3
GHD RAW RICE MATTA BROKEN 1kg,3
GH PONNI RAW RICE STANDARD BG 25Kg,3
GH KURUVA BOILED RICE 20Kg,3
FRESH & PURE GROUNDNUT OIL JR 5L,3
BUSTAAN KINGDOM OF DATES DEGLET 300G,3
GH RICE BPT PP 2kg,3
GH DAILY TUR DAL RATIO 1K,3
COP LOOSE RICE KURUVA DOUBLE BOILED STD,3
FUTANA FRIED LOOSE,3
RAW RICE SONA MASOORI NEW LOOSE,3
RICE SONA MASOORI DIAMOND LOOSE,2
DRY AAM PAPAD LOOSE,2
RICE RAJAKAYANI LOOSE,2
DRIED CHERRY LOOSE,2
Bajra 500g,2
KARMIQ ROASTED NUTS & BERRY MIX BT 100g,2
PH OTH PULSES CHANA RED LOOSE,2
MINIKET STANDARD RICE BG 25Kg,2
GH RAJMA JAMMU MARWAH PP 500g,2
CHANA DAL NEW LOOSE,2
URAD WHITE STD LOOSE,2
ARWA KATARNI PREMIUM RICE BG 25Kg,2
KALI MUCH MOGRA RICE,2
Jowar 500g,2
PLAIN PISTACHIOS LOOSE,2
RICE ATTA LOOSE,2
GH DRY FRUIT DF GIFT BOX 300g GP,2
GH CHAWLI RED 200g,2
Channa Dal PRM 500g,2
FB SIS PLAIN DRY FRUITS,2
GH OWS SANKRANTHI MIX PP 200g,2
GH DAILY SPLIT URAD DAL VAC 500g,2
PUNJAB BASKATI RICE BG 25Kg,2
MINIKET POPULAR RICE 10Kg,2
KARMIQ SALTED MIX PP 200g,2
DRIED GINGER LOOSE,2
SNFLW SEED SHELED LOOSE,2
FB SIS WHO SPICE PANDI CHILLI LOOSE,2
BASMATI KRT PREMIUM BAG 25Kg,2
BUSTAAN KINGDOM OF DATES MAZAFATI 300G,2
FRYMS PAPAD ROUND LOOSE,2
Bombay Rawa/Suji 500g,2
RICE PONNI RAW ECONOMY LOOSE,2
GH RAW RICE HMT PREMIUM 5kg,2
Maida PRM 1kg,2
Coconut Powder 100g,2
TUR DAL AKOLA LOOSE,2
CHOCOLATE CASHEW LOOSE,2
RATNA SUPREME RICE BG 25Kg,2
RICE DEHRADUN MINI LOOSE,2
Turdal STD 1kg,2
RICE DB PREMIUM LOOSE,2
SUGAR CANDY SMALL LOOSE,2
BOILED RICE CHEAP N BEST BAG 25Kg,2
1014RAW RICE BG 25Kg,2
GH BOILED RICE MINI KET 5Kg,2
GH AVALAKHI THICK 500g,2
NILGIRIS ROASTED PUMPKIN SEEDS JR 100g,2
GH RAW RICE BPT 25Kg,2
BUSTAAN HAZELNUT 200g,2
RICE MATTA BROKEN LOOSE,2
FRESH & PURE POW SPICE JEERA 100g,2
BUSTAAN KINGDOM OF DATES AJWA 300G,2
DHANIA LOCAL LOOSE,2
GH WHO SPICE BYADGI CHILLI 500g,2
Sona Masoori Popular Rice 25kg,2
SUNTH LOOSE,2
NILGIRIS IDLI KAR RICE PP 1kg,2
AGRIPURE SUREKHA RICE 10kg,2
GH RAW RICE RAMPAL JOHA 25Kg,2
KARMIQ ROASTED SALTED SEED MIX BT 100g,2
HMT PREMIUM RICE BG 25Kg,2
GH PONNI BOILED RICE PREMIUM BG 25Kg,2
AMBEMOHAR RICE BG 20Kg,2
RAW RICE BARPETA AIZWAN LOOSE,2
HMT KOLAM RICE BG 25Kg,2
RAGI WHOLE PP 5kg,2
RAW RICE TULSI JOHA LOOSE,2
SANGIS KITCHEN CHOLE MASALA BX 100g,2
GH RAJMA JAMMU MARWAH PP 1Kg,2
RICE BSMAT NEW MINI DUBAR LOOSE,2
FRESH & PURE SOYABEAN OIL TN 15Kg,2
COP UNBRANDED BAJRA 2Kg,2
FRESH & PURE KCHI GHNI MUSTRD OIL BT 2L,2
RICE NEW BASMAT PULAV PRM LOOSE,2
NILGIRIS IDLI KAR RICE 5KG,2
SUNS ROSTD&LGT SLT MX NUT 150,2
SANGIS KITCHEN DRY ROSE PETALS PP 6g,2
BENGAL JOHA RAW RICE BAG 25Kg,2
SONA MOONG DAL PP 2Kg,2
Sugar S-30 2kg,2
GH CHIRONJIS 100g,2
Rice Flour 500g,2
DRYFRUIT CASHEW 240 LOOSE,2
GH WAL KAJU 500g,2
SHREE RAM BROKEN RICE,2
MUNAKKA KISMIS LOOSE,2
GH MALAR 100G,2
RICE KAJE RED LOOSE,2
COPU JEERASAR STANDARD BAG 25Kg,2
GOUND LOOSE,2
Rajma Red 500g,2
SANGIS KITCHEN BHARWA MASALA BX 50g,2
Table Saunf 100g,2
Jowar 1kg,2
NILGIRIS GHEE PURE PP 1L,2
URAD GUNDU PREMIUM PP 5Kg,2
EKTAA KATARNI CHIVDA CHIRWA POHA PP 500g,2
ROASTED POHA LOOSE,2
GH DRY FRUIT MINI GIFT BOX,2
BPT RICE BG 25Kg,2
KARMIQ GRANDEUR DFT GIFT BOX 1Kg OP,2
SUGAR MEDIUM LOOSE-PROMO,2
RICE GIDDA STANDARD LOOSE,2
LAXMIBHOG RICE BG 25Kg,2
RESHPTI CHIL LOOSE,2
Rice Sona Masuri PRM 25kg,2
DRY FRUIT KAJU SPECIAL LOOSE,2
COP UNBRANDED JAWAR 2Kg,2
FB SIS WHO SPICE CLOVE LOOSE,2
DAILY PONNI RICE PP 25Kg,2
DASH BOILED LOOSE,2
KARMIQ RSTD SLT WATERMELON SEEDS BT 100g,2
RASMALAI GOLD JAGGERY PP 960g,2
Mustard Big 100g,2
BLACK PEPPER CASHEW LOOSE,2
Kalonji 50g,2
GH PANCH MEWA 500g,2
COPU KRISHNA KAMOD NEW BAG 25Kg,2
SOYABEAN WADI LOOSE,2
PUDINA CASHEW LOOSE,2
GH PONNI BOILED RICE STANDARD BG 25Kg,2
Musturd Small 500g,2
Soya Beans 500g,2
PONNY RAW RICE BG 20Kg,2
BASMATI RICE HAR ROJ LOOSE,2
KALIMUCH STANDRD RICE LOOSE,2
GH KAJU STANDARD 100g,2
GH URAD DAL BADI 200g,2
MOONG DAL PP 5Kg,2
GH SUGAR PACK 500g,2
GH DRY FRUIT GIFT BOX 360g GP,2
AGRIPURE RICE GOVINDBHOG 10kg,2
FRESH & PURE DESI GHEE TP 2L,2
RICE BASMT NEW MINI MOGRA LOOSE,2
JOWAR WHOLE PP 5kg,2
Urad Dal Prm 1kg,2
CHINOOR SUGANDHI RICE BG 25Kg,2
Bajra Loose,2
RICE NEW KRISHNA KAMOD LOOSE,2
GH KURMURA KOLHAPURI 500g,2
DUDHESWAR RICE BG 25Kg,2
PEPPER CASHEW LOOSE,2
JAYA DOUBLE BOIL RICE PRM LOOSE,2
GH CHITMUTYALU RICE 1Kg,2
Urad Round PRM 1kg,2
GH DAILY URAD DAL MOGRA 1kg,2
CHANA+WATANA SPROUT MIX PP 500g,2
RICE NEW HMT SUPREME LOOSE,2
Dry Dates 100g,2
DRY FRT PRUNES LOOSE,1
PANEER TIKKA CSHW LOOSE,1
NILGIRIS RAJABHOGAM PRM BOILED RICE 10kg,1
OTH CEREAL DALIYA LOOSE,1
NILGIRIS JEERA SAMBA RICE 5kg,1
EKTAA URAD DAL 1k,1
PINENUT UNSHELED LOOSE,1
Sona Masuri Raw Rice Std 25Kg,1
GHD MUST 200g+JEERA+METHI+PEPPER 300g OP,1
Idly Rice 1kg,1
NILGIRIS RAJABHOGAM PREM BOILED RICE20kg,1
Turdal Std 500g,1
SHREE AIJAN RICE BG 25Kg,1
GHPR SONA MOONG DAL PP 500g,1
WHEAT LOKWAN GUJARAT LOOSE,1
MILLENIUM MIX LOOSE,1
Methi 200g,1
GH SUGAR BHURA 1kg,1
RAW RICE ZAIKA PREMIUM BAG 25kg,1
GH RAJABHOGAM RICE BG 10Kg,1
Kabuli Channa 500g,1
NILGIRIS PONNI RAW RICE 1kg,1
DRYFRUIT PRUNES LOOSE,1
Channa Dal STD 1kg,1
GH DAILY BESAN 1K,1
JEERASAR RICE BAG 10kg,1
PUNJAB BASKATIRICE 10Kg,1
GH WHO SPICE CHILLI GUNDU STD 500g,1
SWARNA BOILED RICE BAG 25Kg,1
Moong Chilka 500g,1
GH ARWA KATARNI PREMIUM 25Kg,1
BOILED RICE KERALA LOOSE,1
GH DOSA RICE PP 1kg,1
SEEDLESS APRICOT LOOSE,1
GOBINDO BHOG SUPREME RICE BG 25Kg,1
BASKATI SUPRME RICE BG 25Kg,1
F&P COTTON SEED OIL REFINED TIN 15Kg,1
Ground Nut 1kg,1
Methi 100g,1
WHEAT SIHORE A NEW LOOSE,1
AGRIPURE PONNI BOILED SUPREME RICE 10Kg,1
BUSTAAN KINGDOM OF DATES SAFAVI 300G,1
SPROUT MIX PP 500g,1
SURTI KOLAM PREMIUM RICE BG 25Kg,1
Channa dal Std 500g,1
H WHO SPICE WHITE PEPPER 50g,1
SALTED PEANUT LOOSE,1
GH RAW RICE SADHU AIJAN 25kg,1
GH BHAGAR VARAI PP 1Kg,1
GH ALSI FLAX SEED 500g,1
IDLY RICE PP 5Kg,1
Cashew Split 200g,1
MAKAI LOOSE,1
RAJMA JAMMU,1
SUNFLOWER RAMPAL RICE 10Kg,1
Mustard Big 200g,1
GH RED WHEAT RAVA PP 500g,1
GH RICE RAVA PP 1kg,1
GH AVALAKHI THICK 1KG,1
Eating Soda 50g,1
GH AVALAKKI THICK 2Kg,1
RAW RICE SILKY KOLAM NEW LOOSE,1
SABUDANA PREMIUM LOOSE,1
Cassia 50g,1
NILGIRIS PONGAL RAW RICE 1kg,1
Dry Copra 200g,1
DRY FRT DRIED KIWI LOOSE,1
SANDUKANI RAISINS LOOSE,1
GH HMT RICE 5Kg,1
Double Beans 200g,1
SANGIS KITCHEN CHIPOTLE MASALA BX 50g,1
SAFFORN CASHEWS LOOSE,1
NILGIRIS PONNI SILKY RICE 1kg,1
GH POW SPICE DRY GINGER 50g,1
COP UNBRANDED HALDI WHOLE 250g,1
GH RICE PULAV 25Kg,1
RICE BASMATI GOLDEN LOOSE,1
KARMIQ MUNCHIES ALMOND SEA SALT&PEPR 25g,1
DAILY PONNI BOILED RICE LOOSE,1
BOILED RICE AIJAN LOOSE,1
GH SAMBA BROKEN WHEAT FINE PP 1Kg,1
RICE GOBINDO BHOG STANDARD LOOSE,1
BENGAL JOHA RICE 10Kg,1
WHEAT LOKWAN EMERALD LOOSE,1
NILGIRIS SONA STEAM RICE 1kg,1
NILGIRIS RAJABHOGAM PREM BOILED RICE 5kg,1
Sago 500g,1
Moong Green 1kg,1
CL TUR DAL STD LOOSE,1
SALTED ROASTED CASHEW LOOSE,1
BUSTAAN SUNFLWER UNSHELL SEEDS 100g,1
NILGIRS RAISANSDRY FRUITS 2*200g OP,1
AGRIPURE PONNI RAW PREMIUM RICE 10Kg,1
GH KAJU BROKEN 100g,1
RICE SONA MASOORI SILKY LOOSE,1
DRIED MANGO LOOSE,1
KITCHEN KHAJANA RICE 25kg,1
LACHKARI SURTI KOLAM MOGRA RICE,1
BASMATI RICE UKDA THIN LOOSE,1
Urad Round Prm 500g,1
LITCHI CASHEW LOOSE,1
FB SIS WHO SPICE JAIFAL LOOSE,1
RICE BOILED TULAI PANJI LOOSE,1
AMERICAN ALMOND SELECTD LOOSE,1
GH RAW BENGAL JOHA 25Kg,1
NILGIRIS SONA MASOORI BOILED RICE PP 1kg,1
BASKATIRICE 10Kg,1
Black Salt 100g,1
Chironji 50g,1
GH ALSI FLAX SEED 200g,1
BUSTAAN CHIA WHITE SEEDS 100g,1
DHANADAL LOOSE,1
RICE SONA MASOORI SUP NO2 LOOSE,1
PANDI CHILLI LOOSE,1
FRESH & PURE GROUNDNUT OIL TN 15L,1
BASMATI SELLA RICE TIBAR LOOSE,1
WADAKOLAM RICE BG 20Kg,1
NILGIRIS  KOLAM RICE 5kg,1
POHA THICK PREMIUM LOOSE,1
MINIKET SUPREME RICE BG 25Kg,1
NILGIRIS NILGIRIS IDLI KAR RICE 2kg,1
